503,1496799063,9,5.056594203,195,17.02,35.96,84.86,7.8,39.0,12.82,90.77,56.92,16.41,14.87,9.23,1.03,1.54,0.0,3.08,1.54,4.1,12.31,12.31,10.77,7.69,3.08,23.59,2.05,0.51,2.05,3.59,0.0,4.1,1.03,2.56,0.51,0.0,2.05,10.26,0.51,0.0,0.0,0.0,10.77,1.54,2.56,1.54,2.05,0.51,4.1,0.51,0.0,0.0,0.51,4.1,0.0,3.08,0.0,1.54,10.77,3.08,3.08,4.1,3.08,1.03,5.64,15.9,0.51,13.85,1.03,4.62,8.21,3.59,1.03,1.54,0.0,0.0,1.54,0.51,0.0,0.0,0.51,0.0,0.0,18.46,2.05,6.67,0.0,0.0,0.51,0.0,0.0,0.51,5.64,3.08,0.0,2.75,2.8889,3.0,1.0,1.0,1.0,1.71607,1.52771,1.82281,0.9,16,5.217693237,0.04347979798,1004,232,1,i have extremely depressed and yes i ve thought about suicide but my family needs me alive they need me or they may die it s very dire where they live i need pointers on how to find a good city to be homeless in how to obtain a mailing address so i don t lose my ssdi they ve already pulled the stunt of you have 10 days from this mailing to respond or you are kicked off of ssdi give us your last 5 years records they ve done this 4 times already in the past 10 years i ve been rejected for dss services no food stamps i m losing medicaid but still have medicare for now no housing help waiting list here is years and only one agency is still willing to help me a job agency and the workers there are very distraught over my situation as they ve tried very hard with me to help me get a good job i have about 10 solid skills but i keep getting turned away and we cannot figure out why? i don t use drugs or alcohol haven t even smoked weed since a teen and i m about 61 years old
385,1491169611,1,4.881215686,84,31.16,45.27,60.65,1.0,16.8,19.05,94.05,57.14,22.62,17.86,9.52,0.0,0.0,7.14,1.19,4.76,2.38,14.29,4.76,5.95,9.52,1.19,20.24,1.19,1.19,1.19,0.0,1.19,8.33,1.19,7.14,0.0,1.19,2.38,14.29,2.38,0.0,0.0,9.52,5.95,1.19,0.0,1.19,0.0,0.0,3.57,2.38,0.0,2.38,0.0,3.57,3.57,1.19,0.0,0.0,9.52,2.38,2.38,2.38,2.38,1.19,10.71,5.95,2.38,16.67,2.38,10.71,4.76,2.38,1.19,1.19,0.0,1.19,0.0,2.38,1.19,0.0,0.0,1.19,0.0,11.9,5.95,2.38,0.0,0.0,0.0,0.0,0.0,2.38,1.19,0.0,0.0,2.7143,3.0,3.0,1.0,1.2727,1.0,1.80204,1.68158,1.82058,1.0,0,5.205588235,0.0,440,94,1,i come out bleeding and it boy tried to yell at me but he noticed my arm and was like oh my god but then crazyasses started to whine that he was losing his mind so he went back downstairs shortly thereafter it boys parents kicked him out for violence towards the family property damage and refusing to get a job him and crazy ass started haranguing me about me getting them both jobs at my pwork which i didn t want to do honestly
287,1491011548,8,7.648637681,109,45.67,32.33,62.65,76.61,27.25,17.43,86.24,56.88,12.84,4.59,2.75,0.92,0.0,0.0,0.92,8.26,6.42,13.76,10.09,9.17,7.34,2.75,18.35,0.92,1.83,0.92,0.0,5.5,2.75,2.75,0.0,0.0,0.0,0.0,2.75,0.0,0.0,0.0,0.0,11.01,4.59,0.0,0.0,7.34,0.92,2.75,0.0,0.0,0.0,0.0,0.0,0.0,0.0,0.0,0.0,7.34,0.92,0.0,5.5,0.92,0.0,2.75,11.93,0.92,12.84,1.83,10.09,0.92,6.42,0.0,1.83,2.75,0.0,0.0,0.0,0.0,0.0,0.0,0.0,0.0,17.43,2.75,1.83,0.92,0.0,0.92,0.0,0.0,1.83,4.59,3.67,0.92,2.7143,2.625,3.0,1.0,1.0,1.0,1.64784,1.51915,1.77977,1.0,8,7.891956522,0.3075,600,129,0,are there federal or state in laws that govern shelters for shelters that don t accept any federal funds? according to a news story i have found on this shelter they don t accept federal funding grants or any kind of corporate or foundation funds there are so many things going on here that don t seem legal and many more that are totally unethical i ve been here for a month and here s just a couple of the things that are jumping out at me our meds are kept locked up in a cabinet in a room accessible only by staff and resident staff which also seems like a huge conflict of interest
646,1516658897,3,3.24754386,73,31.12,29.17,93.59,2.2,14.6,13.7,90.41,60.27,23.29,20.55,12.33,0.0,0.0,8.22,0.0,2.74,4.11,16.44,5.48,6.85,9.59,2.74,17.81,4.11,2.74,0.0,0.0,1.37,2.74,0.0,2.74,0.0,0.0,2.74,12.33,1.37,1.37,9.59,1.37,6.85,2.74,0.0,0.0,0.0,1.37,2.74,1.37,1.37,0.0,0.0,0.0,0.0,0.0,0.0,0.0,4.11,1.37,0.0,1.37,0.0,1.37,8.22,5.48,1.37,20.55,4.11,6.85,9.59,1.37,1.37,1.37,0.0,0.0,0.0,0.0,0.0,0.0,0.0,0.0,0.0,13.7,5.48,0.0,0.0,0.0,0.0,1.37,0.0,0.0,4.11,2.74,0.0,2.5833,2.625,3.0,1.3333,1.125,1.0,1.76211,1.69062,1.87572,1.0,5,4.565789474,-0.1527777778,375,83,1,i don t post that much so sorry about the formatting! as a preface my mum has always been protective of me but the main drama started on boxing day 26th december she misunderstood me and thought i wasn t going to see her before i moved back to university so she locked herself in her room and began to cry she even told me to pack up my stuff and move to my boyfriend s
74,1529374028,28,5.742328767,67,32.48,5.04,97.53,25.77,13.4,28.36,85.07,55.22,13.43,11.94,10.45,0.0,1.49,0.0,0.0,1.49,2.99,16.42,11.94,10.45,7.46,2.99,23.88,4.48,2.99,0.0,0.0,0.0,2.99,1.49,1.49,0.0,1.49,0.0,2.99,0.0,1.49,0.0,0.0,10.45,1.49,0.0,0.0,1.49,1.49,5.97,2.99,1.49,1.49,0.0,2.99,0.0,1.49,1.49,0.0,11.94,1.49,2.99,5.97,1.49,0.0,2.99,14.93,4.48,14.93,0.0,5.97,8.96,2.99,1.49,0.0,0.0,0.0,0.0,2.99,1.49,1.49,0.0,0.0,0.0,25.37,10.45,7.46,0.0,0.0,0.0,0.0,1.49,0.0,5.97,0.0,0.0,2.8571,2.7273,2.8,1.1667,1.2857,1.0,1.77102,1.45357,1.92824,0.97,15,5.783452055,0.12,387,82,0,i never thought i d actually be homeless without the drugs it s kind of like regular camping except instead of raccoons and bears you gotta look out for tweakers creeps and j cats i plan on starting a work program soon i ve already signed up with probation and i m starting to be my own friend again laughing has helped too endorphins and oxytocin are getting me high as fuck
636,1528240313,191,4.006285714,68,33.48,90.7,81.91,53.41,13.6,14.71,91.18,66.18,25.0,17.65,8.82,1.47,2.94,0.0,4.41,7.35,2.94,19.12,7.35,8.82,5.88,1.47,11.76,5.88,2.94,1.47,1.47,4.41,1.47,1.47,0.0,0.0,0.0,0.0,23.53,0.0,0.0,0.0,1.47,16.18,4.41,0.0,1.47,10.29,1.47,4.41,0.0,0.0,0.0,0.0,0.0,0.0,0.0,0.0,0.0,8.82,7.35,0.0,4.41,0.0,0.0,0.0,11.76,0.0,10.29,1.47,7.35,1.47,0.0,0.0,0.0,0.0,0.0,0.0,0.0,0.0,0.0,0.0,0.0,0.0,13.24,7.35,2.94,0.0,0.0,0.0,0.0,0.0,0.0,1.47,0.0,1.47,2.625,2.8889,2.8,1.1667,1.0,1.0,1.67344,1.48387,1.89015,0.99,22,4.872857143,0.17,348,76,0,i am the caseworker of about 300 homeless men in my city this number fluctuates and i help them with anything and everything if our shelter doesn t offer it i usually know where to send them or find out for them i am here to offer a few basic tips just to help anyone out you are more than welcome to message me about any questions you have
153,1536392747,3,-1.262301587,54,65.78,2.1,87.07,5.77,10.8,9.26,85.19,59.26,12.96,11.11,11.11,0.0,0.0,0.0,0.0,1.85,9.26,14.81,12.96,5.56,3.7,3.7,12.96,0.0,0.0,1.85,9.26,1.85,1.85,0.0,1.85,0.0,0.0,0.0,0.0,0.0,0.0,0.0,0.0,14.81,1.85,1.85,1.85,5.56,0.0,5.56,0.0,0.0,0.0,0.0,5.56,0.0,0.0,0.0,5.56,1.85,0.0,0.0,0.0,0.0,1.85,1.85,11.11,1.85,11.11,1.85,7.41,1.85,1.85,1.85,1.85,1.85,0.0,0.0,0.0,0.0,0.0,0.0,0.0,0.0,14.81,7.41,0.0,0.0,0.0,1.85,0.0,1.85,0.0,0.0,3.7,0.0,2.4286,2.5,3.0,1.1111,1.1429,1.0,1.65757,1.53,1.8488,0.63,12,1.622275132,0.1875,246,60,0,8 i am not a resident of nevada or any other state i have been out of the country for almost 20 years 11 how can i apply for food from the food bank? i think i will be camping about 60 70 km from the city i have no problem carrying the food
669,1516166276,3,-2.134027778,36,9.47,71.09,39.76,2.09,9.0,22.22,88.89,47.22,16.67,13.89,5.56,5.56,0.0,2.78,0.0,2.78,0.0,11.11,8.33,8.33,13.89,2.78,25.0,8.33,5.56,2.78,0.0,5.56,8.33,2.78,5.56,0.0,2.78,0.0,16.67,2.78,2.78,0.0,5.56,22.22,5.56,5.56,2.78,0.0,0.0,8.33,2.78,0.0,0.0,2.78,0.0,0.0,0.0,0.0,0.0,16.67,8.33,0.0,0.0,2.78,5.56,8.33,13.89,0.0,5.56,0.0,2.78,2.78,0.0,0.0,0.0,0.0,0.0,0.0,2.78,0.0,2.78,0.0,0.0,0.0,41.67,11.11,2.78,2.78,2.78,0.0,0.0,0.0,0.0,8.33,0.0,13.89,2.7143,2.4286,2.6,1.125,1.2857,1.0,1.73401,1.38621,1.84654,1.0,6,0.5983333333,-0.04583333333,193,55,1,it s so hard to explain nbsp problems with bob balthazar s fiance i don t know why but he does not like me either we used to be close but b got jealous so we stopped talking as much
162,1483558406,5,7.303285714,69,92.84,95.89,13.9,78.8,13.8,21.74,82.61,43.48,11.59,10.14,2.9,0.0,4.35,2.9,0.0,1.45,4.35,17.39,5.8,2.9,1.45,0.0,11.59,1.45,1.45,1.45,2.9,0.0,5.8,4.35,1.45,0.0,1.45,0.0,15.94,2.9,0.0,5.8,0.0,11.59,2.9,2.9,1.45,2.9,1.45,0.0,2.9,0.0,1.45,1.45,5.8,1.45,4.35,1.45,0.0,8.7,2.9,2.9,5.8,0.0,0.0,2.9,4.35,0.0,13.04,0.0,4.35,8.7,4.35,1.45,0.0,2.9,0.0,1.45,0.0,0.0,0.0,0.0,0.0,0.0,11.59,5.8,0.0,0.0,0.0,1.45,0.0,4.35,0.0,0.0,0.0,0.0,3.0,2.8889,3.0,1.1429,1.2,1.0,1.75025,1.72,1.98919,0.65,0,6.895714286,-0.03333333333,397,72,0,my 42 yr old sister in law died of metastatic breast cancer last night after a 6 year battle i am trying to raise funds to establish an endowed scholarship in her name through olivet nazarene university in illinois to help students with interests in music to honor her memory why would you consider giving to a stranger? because maybe cancer has touched your life donna was your everyday woman
297,1538010775,4,3.733904762,85,18.71,14.48,99.0,1.0,17.0,11.76,98.82,60.0,18.82,10.59,9.41,0.0,1.18,0.0,0.0,8.24,2.35,15.29,7.06,14.12,8.24,2.35,17.65,7.06,4.71,2.35,1.18,1.18,10.59,1.18,9.41,5.88,2.35,1.18,3.53,0.0,1.18,0.0,1.18,15.29,2.35,0.0,2.35,3.53,3.53,3.53,0.0,0.0,0.0,0.0,5.88,3.53,2.35,0.0,0.0,3.53,0.0,0.0,3.53,0.0,0.0,4.71,12.94,2.35,28.24,3.53,7.06,17.65,1.18,0.0,0.0,0.0,0.0,0.0,0.0,0.0,0.0,0.0,0.0,0.0,15.29,5.88,3.53,0.0,0.0,0.0,0.0,0.0,0.0,5.88,0.0,0.0,2.8333,2.8571,2.8,1.0,1.0,1.0,1.74582,1.43,1.77396,1.0,8,5.157619048,0.0512987013,450,98,1,i m 14 years old going in highschool i ve had anxiety mostly health anxiety my entire life but it usually only lasted a day at times and my anxiety only when off it certain not daily things now i suffer daily and want it gone i ve posted here before but just want to know what you guys think of this recently someone passed away in there sleep from a heart attack and now i m anxious like never before i ll wake up with panic attacks and such
56,1522869607,6,9.06974359,114,17.96,4.8,99.0,13.81,22.8,17.54,97.37,62.28,23.68,16.67,14.91,0.0,0.0,0.0,1.75,7.02,3.51,15.79,6.14,9.65,12.28,0.88,18.42,2.63,5.26,1.75,3.51,3.51,3.51,0.88,1.75,0.0,0.88,0.0,8.77,3.51,0.0,0.88,2.63,23.68,5.26,1.75,0.88,13.16,1.75,9.65,1.75,0.0,0.0,1.75,1.75,0.0,1.75,0.0,0.0,3.51,1.75,0.0,0.88,0.88,0.0,2.63,11.4,0.0,17.54,2.63,3.51,11.4,0.88,0.88,0.0,0.0,0.0,0.0,0.0,0.0,0.0,0.0,0.0,0.0,11.4,4.39,4.39,0.0,0.0,0.0,0.0,0.0,0.0,2.63,0.0,0.0,2.8333,2.8,3.0,1.1111,1.2,1.0,1.7609,1.45684,1.99749,1.0,5,8.664205128,-0.2833333333,593,127,0,like i don t think they happen if i distract myself with the internet or doing some hobby that i like i remember feeling like this at least once a week ever since i was around 15 or so i used to have nightmares about either fighting for life with my brother or my dad or someone else or about seizures happening to me or people around me every day now i have them maybe once a week or two i get something that feels like an adrenaline rush when i m bringing this up for instance as i m writing this or when my brother decides to visit my mom and sometimes it just happens randomly
45,1516557412,28,12.11,147,56.05,52.72,46.05,64.46,29.4,10.88,93.88,56.46,19.05,13.61,6.12,0.0,0.0,6.12,1.36,5.44,6.12,13.61,6.8,2.72,8.84,0.68,14.97,3.4,0.68,0.68,1.36,1.36,11.56,6.8,4.76,0.68,2.04,0.0,10.2,0.68,0.0,2.72,4.08,10.2,4.76,1.36,2.72,2.72,0.68,2.72,4.08,0.0,0.68,3.4,4.08,0.68,3.4,0.0,0.0,9.52,1.36,5.44,3.4,1.36,0.0,2.72,10.2,0.68,15.65,5.44,6.12,5.44,1.36,0.68,0.68,0.68,1.36,0.0,0.0,0.0,0.0,0.0,0.0,0.0,8.84,3.4,4.76,0.0,0.68,0.0,0.0,0.0,0.0,0.0,0.0,0.0,2.8333,3.0,3.0,1.0,1.125,1.0,1.76146,1.59339,1.98601,0.93,7,11.12770068,0.183175915,747,160,0,regarding my abuser i still feel my heart ache with compassion and the understanding that no human being is born a monster it is an environment poisoned with violence they grew up in that guides them into life as an abuser i have prayed every single day for john doe and his foster family in the hopes that he can overcome his inner demons and lead a life of peace but if and when he finds a new woman to victimize and rob her of dignity worth and benevolence i feel proud that i have taken steps to ensure that even if she is too afraid to step forward i have taken that first step in her honor i feel proud to have set the precedent to lead him on a path for growth and healing if he chooses i feel proud to have broken that silence
534,1529825055,0,3.071666667,53,43.92,9.34,96.73,25.77,10.6,13.21,94.34,62.26,15.09,13.21,13.21,0.0,0.0,0.0,0.0,1.89,11.32,11.32,11.32,7.55,9.43,1.89,11.32,7.55,1.89,1.89,0.0,3.77,7.55,3.77,3.77,1.89,0.0,0.0,1.89,0.0,0.0,0.0,0.0,11.32,0.0,1.89,0.0,3.77,5.66,0.0,9.43,3.77,0.0,0.0,3.77,0.0,3.77,0.0,0.0,1.89,0.0,1.89,0.0,0.0,0.0,11.32,1.89,1.89,18.87,0.0,9.43,9.43,0.0,0.0,1.89,0.0,0.0,0.0,0.0,0.0,0.0,0.0,0.0,0.0,11.32,9.43,0.0,0.0,0.0,0.0,0.0,0.0,0.0,1.89,0.0,0.0,2.8462,2.5,3.0,1.0,1.1429,1.0,1.69967,1.51163,1.83985,0.5,3,5.666444444,-0.03240740741,276,59,1,i had a pretty creepy experience almost a week ago i ve never had a hallucination like that so disconnected and vivid and super weird i was anxious because i was in a building filled with people then all of a sudden i hallucinated where i was in a dark room all by myself
486,1504023583,9,8.330093458,102,71.03,7.08,94.12,5.16,20.4,21.57,84.31,58.82,15.69,11.76,11.76,0.0,0.0,0.0,0.0,3.92,7.84,18.63,7.84,5.88,7.84,1.96,10.78,3.92,1.96,0.98,0.0,0.98,1.96,0.0,1.96,1.96,0.0,0.0,2.94,0.0,0.0,0.0,0.0,5.88,0.0,1.96,0.0,0.0,0.0,3.92,0.98,0.0,0.0,0.98,1.96,0.0,1.96,0.0,0.0,3.92,1.96,0.98,0.0,0.98,0.0,5.88,4.9,3.92,14.71,1.96,6.86,5.88,7.84,0.98,0.0,0.0,0.0,0.0,0.0,0.0,0.0,0.0,0.0,0.0,15.69,4.9,2.94,0.0,0.0,0.0,0.0,0.98,1.96,4.9,0.0,0.0,2.7,2.8,3.0,1.0,1.125,1.0,1.68344,1.56235,1.84977,0.92,5,9.518616822,-0.04791666667,544,116,1,it s hard for me to even type this but today i dropped my classes after only a week of school i ve been in school for a while just got my associate s degree in liberal arts at a community college and was planning on going to university for an english degree i will note that the majority of my classes were online as i can t focus in an in person class due to my social anxiety however i panicked about my future and how english isn t a lucrative field and changed gears i enrolled in a program that was for physical therapy assisting
586,1509573239,3,6.176153846,75,26.4,29.68,20.24,25.77,15.0,24.0,89.33,64.0,22.67,17.33,9.33,1.33,0.0,6.67,0.0,5.33,2.67,18.67,8.0,8.0,8.0,4.0,16.0,4.0,5.33,0.0,0.0,0.0,2.67,1.33,1.33,1.33,0.0,0.0,13.33,0.0,0.0,6.67,0.0,20.0,4.0,1.33,4.0,10.67,0.0,6.67,2.67,1.33,0.0,1.33,1.33,0.0,1.33,0.0,0.0,5.33,5.33,0.0,0.0,0.0,0.0,0.0,16.0,0.0,6.67,1.33,1.33,5.33,1.33,1.33,0.0,0.0,0.0,0.0,0.0,0.0,0.0,0.0,0.0,0.0,16.0,6.67,4.0,0.0,0.0,0.0,0.0,0.0,0.0,4.0,0.0,1.33,2.75,3.0,3.0,1.0,1.0,1.0,1.76494,1.53714,2.04662,0.81,0,6.227333333,0.06818181818,410,85,0,so this is a new dynamic i am learning and attempting to exercise patience with but sometimes i message her pictures of animals or just something about my day even if she doesn t respond i don t mind i just like to share i don t want to bombard her with questions about her opinion on the nature of our friendship relationship or make her feel pressure like i want something to happen faster than it is
77,1515028160,2,7.533559322,113,15.83,73.22,85.82,6.25,22.6,7.96,93.81,62.83,23.89,15.93,5.31,3.54,0.0,7.08,0.0,7.96,4.42,11.5,12.39,5.31,5.31,3.54,25.66,0.0,0.0,1.77,2.65,0.88,1.77,0.0,1.77,0.0,0.0,1.77,15.93,0.0,0.88,0.0,7.96,14.16,3.54,2.65,4.42,3.54,0.0,4.42,1.77,0.0,1.77,0.0,0.88,0.0,0.88,0.0,0.0,7.96,5.31,0.88,1.77,0.0,0.0,7.96,11.5,4.42,25.66,2.65,10.62,13.27,2.65,0.0,0.88,0.0,0.0,0.0,0.88,0.0,0.0,0.0,0.0,0.0,17.7,4.42,3.54,0.0,0.0,0.0,0.0,0.0,0.0,3.54,5.31,0.88,2.5556,2.5,3.0,1.125,1.125,1.0,1.69116,1.62474,1.9056,1.0,16,7.214,-0.02083333333,557,135,0,my now ex boyfriend 19m broke up with me 20f 4 days ago we would have been together for 6 months this sunday however the way in which he did it leaves me wondering if he left the door open or not the reason why he broke up with me is that this coming semester he will be working in class for 12 hours a day and he doesn t want to put me through that since he won t have enough time to give me he then said that he didn t think this would be the last time we spoke and that we would somehow find our way back into each other s lives eventually
9,1520659298,7,5.789629121,104,90.76,80.65,51.03,99.0,14.86,15.38,89.42,46.15,14.42,12.5,3.85,0.96,0.0,7.69,0.0,1.92,5.77,16.35,2.88,1.92,4.81,0.0,9.62,11.54,0.0,0.0,5.77,0.96,13.46,9.62,2.88,0.0,1.92,0.0,11.54,0.0,0.96,0.0,7.69,5.77,1.92,1.92,0.0,1.92,0.96,0.0,2.88,0.96,0.0,0.0,3.85,0.0,0.96,0.0,2.88,10.58,3.85,3.85,2.88,0.96,0.0,8.65,0.96,0.96,23.08,1.92,12.5,7.69,1.92,0.0,1.92,0.0,0.0,0.0,0.0,0.0,0.0,0.0,0.0,0.0,19.23,11.54,4.81,0.0,0.0,0.0,0.0,0.96,1.92,0.0,0.0,0.0,2.8571,2.5,3.0,1.0,1.0,1.0,1.70685,1.73571,1.88339,1.0,7,5.97543956,0.2589646465,561,119,0,this new roommate lived 3 hours away in an post code envious town and seemed super sweet funny and super handsome with a successful career mapped out in front of him i agreed to meet him for dinner half way between our homes in san leandro he showed up with roses a million watt smile and a full arsenal of lies within 5 days he had made the journey to personally escort me and my belongings to his personal prison he had concocted for his next victim me the first week he was sweet attentive almost too kind then one morning it all changed
85,1541706213,27,8.446947368,91,16.63,41.32,89.63,1.1,18.2,16.48,94.51,59.34,26.37,14.29,9.89,0.0,3.3,0.0,1.1,12.09,1.1,15.38,8.79,8.79,4.4,2.2,26.37,4.4,4.4,2.2,0.0,4.4,5.49,1.1,4.4,0.0,0.0,1.1,9.89,0.0,1.1,0.0,1.1,21.98,8.79,4.4,1.1,2.2,3.3,3.3,4.4,0.0,1.1,3.3,0.0,0.0,0.0,0.0,0.0,0.0,0.0,0.0,0.0,0.0,0.0,10.99,12.09,1.1,7.69,1.1,3.3,2.2,0.0,0.0,0.0,0.0,0.0,0.0,0.0,0.0,0.0,0.0,0.0,0.0,8.79,5.49,0.0,0.0,0.0,0.0,0.0,0.0,0.0,3.3,0.0,0.0,3.0,2.4286,3.0,1.0,1.0,1.0,1.73148,1.44471,1.9371,1.0,5,7.594736842,-0.003125,507,99,0,i just wanted to say thank you to everyone that posts on here i just found this subreddit yesterday and reading all of your guys posts have made me feel so much less alone knowing that other people understand what i m going through for some reason has helped me tremendously particularly a post that someone made about feeling like their trauma isnt real and like convincing yourself that it didnt happen i have felt like i m crazy for years because i was in such deep denial about what happened to me
584,1509573239,3,9.915128205,113,24.66,60.48,88.86,1.0,28.25,17.7,94.69,58.41,25.66,17.7,9.73,0.88,0.0,6.19,0.88,7.96,3.54,13.27,10.62,3.54,6.19,0.88,26.55,5.31,3.54,0.0,0.88,0.88,8.85,2.65,6.19,3.54,0.88,0.88,15.93,0.0,0.0,7.08,0.0,14.16,4.42,2.65,0.0,4.42,0.0,3.54,3.54,0.0,2.65,0.88,0.88,0.0,0.88,0.0,0.0,7.96,2.65,3.54,1.77,1.77,0.88,7.08,17.7,2.65,16.81,3.54,6.19,7.08,0.88,0.0,0.0,0.0,0.0,0.0,0.0,0.0,0.0,0.0,0.0,0.0,15.93,3.54,5.31,0.88,0.0,0.0,0.0,0.88,0.0,3.54,1.77,0.0,2.8462,2.8571,2.8,1.0,1.1429,1.0,1.76952,1.58614,1.92002,0.81,0,10.17702564,0.1774305556,613,130,0,3 days before she called me pretty upset to say that she didn t feel able to come naturally i ve learned that she suffers from panic attacks occasionally and has also said that she is reluctant to try a full relationship because of worries that i ll outgrow her or find someone else we have gone on dates since she has said these things eventually i put the pieces together and began to understand her a little better but i also have my own neurological obstacles that have affected my thinking with this girl i m going to do my best to lay them out now like i mentioned i have adhd in a serious way
266,1532413337,4,0.9783333333,53,24.44,98.08,1.0,89.18,10.6,11.32,100.0,64.15,24.53,18.87,1.89,0.0,0.0,15.09,1.89,5.66,1.89,18.87,7.55,3.77,13.21,1.89,18.87,9.43,3.77,5.66,0.0,3.77,7.55,5.66,1.89,1.89,0.0,0.0,26.42,0.0,1.89,0.0,15.09,15.09,1.89,1.89,1.89,7.55,1.89,1.89,5.66,1.89,3.77,0.0,1.89,0.0,0.0,0.0,1.89,9.43,3.77,1.89,1.89,1.89,1.89,0.0,18.87,0.0,7.55,1.89,5.66,0.0,0.0,1.89,0.0,0.0,0.0,0.0,0.0,0.0,0.0,0.0,0.0,0.0,11.32,7.55,0.0,0.0,0.0,1.89,0.0,0.0,0.0,1.89,0.0,0.0,3.0,2.8889,2.6,1.125,1.1429,1.0,1.7189,1.532,1.81774,0.84,4,2.388666667,0.2541666667,252,59,0,he seems hesitant to leave his friends and says he watches out for them and he s not ready to quit drinking which is totally honest and fine how can i be a help to him? as far as getting him some things he needs and any advice on what to say to him
182,1525056428,6,1.180154739,135,3.5,41.22,12.42,8.22,27.0,7.41,97.04,69.63,31.11,27.41,14.81,0.74,0.0,11.85,0.0,3.7,2.22,12.59,11.85,2.96,11.11,3.7,22.96,2.22,0.0,1.48,0.74,0.0,8.89,3.7,5.19,0.74,1.48,2.22,21.48,1.48,0.0,2.22,11.11,11.11,2.22,2.96,2.22,2.22,0.74,5.93,3.7,1.48,2.22,0.0,5.93,0.74,2.22,0.0,0.0,9.63,3.7,2.96,2.22,1.48,0.74,2.22,17.78,1.48,5.19,0.0,2.96,2.22,0.0,0.0,0.0,0.0,0.0,0.0,0.0,0.0,0.0,0.0,0.0,0.0,8.15,3.7,0.0,0.0,0.0,0.0,0.0,0.0,0.0,4.44,0.0,0.0,3.0,2.6667,3.0,1.0,1.1818,1.0,1.74841,1.55462,1.90774,0.88,5,3.133913604,0.136969697,626,152,1,i ve tried to reason with him and tell him i love him and there is no reason for him to beat me and he says that he knows i love him and i should see that he loves me too but i don t listen to him and not listening to him will cause me to lose everything the physical abuse really has damaged me mentally and lowered my self esteem i ve been super depressed and i m scared for what i ll do to myself if i don t get out or if i do get out of this and have to live a life without him we have a 3 month old daughter and he is in love with her when he beats me i hate him but seeing him with my daughter makes my heart melt
653,1525930278,4,0.4734615385,74,17.13,65.76,92.7,51.03,14.8,8.11,95.95,63.51,25.68,18.92,10.81,1.35,1.35,4.05,1.35,6.76,2.7,16.22,10.81,8.11,5.41,2.7,27.03,1.35,0.0,2.7,2.7,0.0,4.05,2.7,1.35,0.0,1.35,0.0,20.27,0.0,1.35,4.05,0.0,13.51,2.7,2.7,1.35,1.35,1.35,4.05,4.05,0.0,2.7,1.35,0.0,0.0,0.0,0.0,0.0,12.16,5.41,1.35,4.05,1.35,0.0,16.22,6.76,1.35,17.57,4.05,6.76,8.11,0.0,0.0,0.0,0.0,1.35,1.35,1.35,1.35,0.0,0.0,0.0,0.0,21.62,5.41,2.7,0.0,0.0,0.0,2.7,0.0,2.7,5.41,2.7,0.0,2.7778,2.625,2.6,1.1429,1.0,1.0,1.70155,1.46667,1.84315,0.84,2,1.827884615,0.298735119,367,90,0,i was very interested but she kept saying don t go! i want you here! i decided to say to hell with it and went when i got there i met back up with an old friend of about 6 years i ll call her sha to make this easy someone who i d been crushing on since we first met the feelings weren t gone but they were buried under everything she had filled my mind with
455,1515397178,5,2.660655738,60,73.6,69.14,43.37,6.91,12.0,13.33,91.67,61.67,21.67,16.67,6.67,1.67,0.0,8.33,0.0,5.0,8.33,18.33,8.33,1.67,5.0,1.67,25.0,1.67,0.0,0.0,0.0,1.67,5.0,1.67,3.33,0.0,3.33,0.0,13.33,0.0,0.0,0.0,8.33,6.67,1.67,0.0,1.67,0.0,1.67,1.67,3.33,0.0,3.33,0.0,0.0,0.0,0.0,0.0,0.0,6.67,1.67,0.0,3.33,0.0,1.67,10.0,6.67,0.0,20.0,5.0,13.33,3.33,0.0,0.0,0.0,3.33,0.0,0.0,0.0,0.0,0.0,0.0,0.0,0.0,13.33,8.33,3.33,0.0,0.0,0.0,0.0,0.0,0.0,1.67,0.0,0.0,2.5,2.4545,3.0,1.25,1.1818,1.0,1.69619,1.568,1.78929,0.86,4,3.869639344,-0.0375,300,68,1,the way he was acting was disproportional to the situation he is yelling at me nonstop we pulled into a store he kept yelling mean things at me to the point i was asking him to stop over and over telling him i didn t want it to escalate and to please go into the store it all happened so fast
402,1525975950,1,3.148333333,70,31.77,28.39,84.71,1.0,14.0,11.43,92.86,55.71,20.0,11.43,10.0,0.0,0.0,0.0,1.43,8.57,7.14,11.43,8.57,7.14,7.14,2.86,21.43,2.86,2.86,2.86,0.0,2.86,4.29,0.0,4.29,2.86,0.0,0.0,8.57,0.0,0.0,4.29,1.43,11.43,5.71,2.86,1.43,0.0,1.43,1.43,2.86,0.0,0.0,2.86,1.43,0.0,1.43,0.0,0.0,10.0,0.0,2.86,2.86,4.29,0.0,0.0,21.43,0.0,11.43,1.43,7.14,2.86,4.29,0.0,0.0,1.43,0.0,0.0,0.0,0.0,0.0,0.0,0.0,0.0,14.29,7.14,1.43,0.0,0.0,0.0,0.0,1.43,0.0,2.86,0.0,1.43,2.7273,2.625,3.0,1.0,1.1429,1.0,1.75109,1.51803,1.88336,0.67,3,4.167777778,-0.105,358,77,1,i get so stressed at work i feel like women get all the preferential treatment also the few women who are in charge just spend their time micro managing the men while letting the other females just slide by doing minimal work i don t get it it causes me huge stress because i feel like im living in an unfair world and i don t know what to do about it
344,1519108125,16,6.557674419,85,31.98,59.29,99.0,3.42,17.0,16.47,92.94,60.0,22.35,18.82,12.94,0.0,4.71,0.0,1.18,3.53,2.35,16.47,1.18,11.76,7.06,3.53,11.76,1.18,0.0,3.53,0.0,3.53,2.35,0.0,2.35,1.18,1.18,0.0,17.65,7.06,1.18,2.35,1.18,18.82,8.24,3.53,1.18,1.18,2.35,3.53,0.0,0.0,0.0,0.0,0.0,0.0,0.0,0.0,0.0,7.06,5.88,0.0,0.0,1.18,0.0,0.0,9.41,1.18,18.82,2.35,8.24,9.41,0.0,2.35,2.35,0.0,0.0,0.0,0.0,0.0,0.0,0.0,0.0,0.0,24.71,5.88,7.06,0.0,0.0,0.0,0.0,0.0,2.35,4.71,4.71,0.0,2.625,2.5714,2.6,1.125,1.1429,1.0,1.71637,1.50933,1.85905,1.0,1,6.622651163,-0.01060606061,458,107,1,when i think about your reasoning behind not letting me homeschool back then i realize now how much it contradicts your decision in ripping my extended family away from me by pushing me to put myself out there and make new friends i only ever feared that you would find a way to take them all away from me somehow to this day when i think of the word family i think of multiple cousins aunts and uncles names etc not you not sister s name
