orig_index,social_timestamp,social_karma,syntax_ari,lex_liwc_WC,lex_liwc_Analytic,lex_liwc_Clout,lex_liwc_Authentic,lex_liwc_Tone,lex_liwc_WPS,lex_liwc_Sixltr,lex_liwc_Dic,lex_liwc_function,lex_liwc_pronoun,lex_liwc_ppron,lex_liwc_i,lex_liwc_we,lex_liwc_you,lex_liwc_shehe,lex_liwc_they,lex_liwc_ipron,lex_liwc_article,lex_liwc_prep,lex_liwc_auxverb,lex_liwc_adverb,lex_liwc_conj,lex_liwc_negate,lex_liwc_verb,lex_liwc_adj,lex_liwc_compare,lex_liwc_interrog,lex_liwc_number,lex_liwc_quant,lex_liwc_affect,lex_liwc_posemo,lex_liwc_negemo,lex_liwc_anx,lex_liwc_anger,lex_liwc_sad,lex_liwc_social,lex_liwc_family,lex_liwc_friend,lex_liwc_female,lex_liwc_male,lex_liwc_cogproc,lex_liwc_insight,lex_liwc_cause,lex_liwc_discrep,lex_liwc_tentat,lex_liwc_certain,lex_liwc_differ,lex_liwc_percept,lex_liwc_see,lex_liwc_hear,lex_liwc_feel,lex_liwc_bio,lex_liwc_body,lex_liwc_health,lex_liwc_sexual,lex_liwc_ingest,lex_liwc_drives,lex_liwc_affiliation,lex_liwc_achieve,lex_liwc_power,lex_liwc_reward,lex_liwc_risk,lex_liwc_focuspast,lex_liwc_focuspresent,lex_liwc_focusfuture,lex_liwc_relativ,lex_liwc_motion,lex_liwc_space,lex_liwc_time,lex_liwc_work,lex_liwc_leisure,lex_liwc_home,lex_liwc_money,lex_liwc_relig,lex_liwc_death,lex_liwc_informal,lex_liwc_swear,lex_liwc_netspeak,lex_liwc_assent,lex_liwc_nonflu,lex_liwc_filler,lex_liwc_AllPunc,lex_liwc_Period,lex_liwc_Comma,lex_liwc_Colon,lex_liwc_SemiC,lex_liwc_QMark,lex_liwc_Exclam,lex_liwc_Dash,lex_liwc_Quote,lex_liwc_Apostro,lex_liwc_Parenth,lex_liwc_OtherP,lex_dal_max_pleasantness,lex_dal_max_activation,lex_dal_max_imagery,lex_dal_min_pleasantness,lex_dal_min_activation,lex_dal_min_imagery,lex_dal_avg_activation,lex_dal_avg_imagery,lex_dal_avg_pleasantness,social_upvote_ratio,social_num_comments,syntax_fk_grade,sentiment,char_len,token_len,label,clean_text
136,1525477560,3,2.265258216,70,39.33,19.58,93.3,1.0,14.0,5.71,92.86,62.86,14.29,7.14,5.71,0.0,0.0,0.0,1.43,7.14,5.71,15.71,14.29,7.14,8.57,1.43,17.14,8.57,8.57,0.0,2.86,4.29,5.71,0.0,5.71,0.0,0.0,4.29,4.29,0.0,0.0,0.0,0.0,15.71,1.43,0.0,1.43,7.14,1.43,5.71,1.43,0.0,0.0,1.43,1.43,1.43,0.0,0.0,0.0,5.71,0.0,0.0,2.86,1.43,1.43,4.29,12.86,0.0,18.57,0.0,8.57,10.0,0.0,0.0,0.0,0.0,0.0,0.0,0.0,0.0,0.0,0.0,0.0,0.0,17.14,7.14,10.0,0.0,0.0,0.0,0.0,0.0,0.0,0.0,0.0,0.0,2.7143,2.25,2.8,1.125,1.1818,1.0,1.65051,1.4625,1.8131,1.0,10,2.98556338,-0.11,349,83,1,but i have been on about a dozen times and have been hung up on nine it is always the same issue sadly i get depressed it is late i cannot sleep or stop thinking about past trauma and i would just like to talk to someone but the bulk of them have hung up some almost immediately and some after longer it is the longer ones that hurt more
144,1523790858,10,6.092142857,54,39.91,35.54,92.47,60.88,13.5,24.07,92.59,55.56,24.07,20.37,16.67,1.85,0.0,1.85,0.0,3.7,1.85,16.67,12.96,1.85,3.7,0.0,24.07,3.7,1.85,1.85,1.85,0.0,1.85,1.85,0.0,0.0,0.0,0.0,12.96,1.85,0.0,0.0,3.7,3.7,0.0,0.0,1.85,0.0,0.0,1.85,1.85,1.85,0.0,0.0,5.56,0.0,5.56,0.0,0.0,7.41,3.7,0.0,1.85,1.85,0.0,5.56,14.81,0.0,14.81,0.0,7.41,7.41,0.0,1.85,5.56,0.0,0.0,0.0,5.56,0.0,1.85,0.0,0.0,0.0,18.52,7.41,5.56,0.0,0.0,0.0,0.0,1.85,0.0,3.7,0.0,0.0,3.0,2.625,3.0,1.1818,1.1429,1.0,1.70744,1.5375,1.93238,0.86,5,6.937857143,0.1,304,62,0,hey redditors i am looking for advice and suggestions about what i should do with my current living situation i have lived in my current apartment for 2 years and took up tenancy after i separated from my ex husband he kept our apartment the apartment i m living in is comfortable enough it s mine
414,1517244735,117,1.603558559,71,3.2,55.59,24.72,1.98,14.2,11.27,94.37,71.83,30.99,21.13,11.27,0.0,0.0,9.86,0.0,9.86,0.0,18.31,12.68,8.45,11.27,1.41,18.31,2.82,1.41,5.63,0.0,0.0,2.82,0.0,2.82,0.0,1.41,0.0,16.9,1.41,2.82,5.63,8.45,8.45,1.41,4.23,0.0,1.41,0.0,2.82,1.41,1.41,0.0,0.0,4.23,4.23,0.0,0.0,0.0,5.63,1.41,0.0,2.82,1.41,0.0,4.23,14.08,1.41,11.27,2.82,2.82,4.23,0.0,0.0,0.0,0.0,0.0,0.0,0.0,0.0,0.0,0.0,0.0,0.0,14.08,4.23,1.41,0.0,0.0,2.82,0.0,1.41,0.0,4.23,0.0,0.0,2.375,2.625,3.0,1.0,1.0,1.0,1.62789,1.51077,1.78348,0.9,33,3.89027027,-0.5,341,79,1,plus she sent him pictures of her ultrasound now i m just heart broken because i was head over heels for this guy and i m also disgusted by what he did to this girl i don t know how to confront him about this or how to handle this situation properly i am going to break up with him but what do i do after i end it? do i tell his fiancee?
453,1541732399,0,9.126814159,112,97.17,32.77,94.05,41.94,22.4,16.96,83.04,48.21,8.93,8.93,8.93,0.0,0.0,0.0,0.0,0.0,7.14,21.43,6.25,1.79,5.36,0.0,13.39,5.36,6.25,0.0,2.68,0.0,2.68,1.79,0.89,0.0,0.0,0.0,5.36,0.0,0.89,0.0,0.89,8.93,2.68,0.0,2.68,2.68,0.89,0.89,0.89,0.0,0.0,0.0,0.0,0.0,0.0,0.0,0.0,8.93,0.89,3.57,4.46,1.79,0.89,0.89,11.61,0.89,20.54,0.0,13.39,6.25,7.14,0.89,0.0,0.89,0.0,0.0,0.0,0.0,0.0,0.0,0.0,0.0,11.61,4.46,5.36,0.0,0.0,0.0,0.0,0.89,0.0,0.89,0.0,0.0,3.0,2.6667,3.0,1.1111,1.1818,1.0,1.73307,1.62529,1.94802,0.42,0,9.305415929,0.1541666667,584,123,0,hi guys i m a current english major at my first year in uni trying to save up enough money to participate in an in depth language study in hokkaido japan my career goal has always been to teach english in asia and after years of deliberation and comparing the different countries i could teach in i believe japan is best suited to me the only problem is my current school only offers japanese 1 and 2 and i need to be as close to fluent as possible in order to give me an edge in the hiring process i know the prospect of studying abroad in asia seems like a cushy vacation
5,1515778002,7,0.9107142857,57,90.97,63.73,28.23,25.77,14.25,10.53,85.96,50.88,10.53,7.02,3.51,0.0,0.0,0.0,3.51,3.51,14.04,12.28,7.02,3.51,5.26,1.75,19.3,5.26,1.75,0.0,1.75,0.0,3.51,1.75,1.75,0.0,0.0,1.75,12.28,0.0,1.75,0.0,0.0,8.77,0.0,5.26,0.0,0.0,0.0,3.51,3.51,0.0,1.75,1.75,0.0,0.0,0.0,0.0,0.0,7.02,1.75,0.0,3.51,1.75,0.0,10.53,10.53,0.0,10.53,1.75,5.26,3.51,7.02,0.0,0.0,1.75,0.0,0.0,0.0,0.0,0.0,0.0,0.0,0.0,15.79,5.26,1.75,0.0,0.0,0.0,1.75,1.75,0.0,1.75,0.0,3.51,2.625,2.625,2.6,1.1429,1.0,1.0,1.70441,1.56364,1.76971,0.7,16,3.28952381,-0.275,293,66,0,thanks edit 1 fuel receipt as requested url sorry for the long responses i went to spend the night at a friends because it got really cold here! the police said they don t give out a copy of the report but they gave me an incident number that can be used to verify the report was filed
279,1504814571,4,8.569459459,69,73.77,97.02,35.93,99.0,23.0,20.29,86.96,46.38,11.59,10.14,1.45,0.0,8.7,0.0,0.0,1.45,4.35,13.04,10.14,1.45,5.8,0.0,15.94,1.45,1.45,0.0,8.7,1.45,8.7,8.7,0.0,0.0,0.0,0.0,17.39,0.0,0.0,0.0,0.0,15.94,4.35,0.0,5.8,8.7,1.45,5.8,1.45,0.0,1.45,0.0,0.0,0.0,0.0,0.0,0.0,4.35,1.45,1.45,1.45,2.9,0.0,1.45,7.25,4.35,13.04,2.9,7.25,2.9,0.0,1.45,0.0,0.0,0.0,0.0,0.0,0.0,0.0,0.0,0.0,0.0,21.74,4.35,8.7,1.45,0.0,0.0,0.0,0.0,0.0,0.0,0.0,7.25,3.0,2.75,3.0,1.2857,1.3333,1.0,1.71153,1.55088,1.94243,0.75,0,9.325,0.125,404,84,0,if you are interested in participating you will be asked to complete an anonymous online survey that will take approximately 20 to 30 minutes one time only if you are interested in participating please click on the following link url or if you would like further information please message me for your participation you may choose to enter a raffle to win one of eight 25 00 url gift cards
57,1517347400,3,4.627795699,59,36.24,80.15,67.53,57.83,11.8,20.34,91.53,49.15,15.25,8.47,5.08,0.0,1.69,1.69,0.0,6.78,5.08,10.17,6.78,10.17,6.78,1.69,15.25,6.78,1.69,1.69,3.39,3.39,5.08,3.39,1.69,0.0,0.0,0.0,18.64,0.0,3.39,5.08,1.69,10.17,0.0,1.69,0.0,3.39,0.0,5.08,1.69,0.0,1.69,0.0,1.69,0.0,0.0,1.69,0.0,11.86,5.08,1.69,0.0,5.08,0.0,10.17,1.69,0.0,15.25,5.08,3.39,6.78,0.0,1.69,0.0,0.0,0.0,0.0,3.39,0.0,0.0,0.0,1.69,0.0,27.12,11.86,10.17,0.0,0.0,0.0,0.0,0.0,3.39,1.69,0.0,0.0,2.7778,2.625,3.0,1.2857,1.25,1.0,1.75567,1.50417,1.9559,0.67,3,4.998064516,0.3702380952,349,75,0,throwaway changed names etc my ex and i dated for about 2 years and had an incredible relationship traveling great sex got along with each others family s you get the point this was also my first serious relationship steph was the kind of girl who didnt click too well with other girls so she gravitated towards guy friends more often
423,1537044443,18,4.352142857,81,93.97,40.24,99.0,25.77,16.2,12.35,87.65,49.38,16.05,13.58,9.88,0.0,0.0,3.7,0.0,2.47,8.64,19.75,7.41,2.47,1.23,0.0,16.05,4.94,3.7,0.0,3.7,4.94,0.0,0.0,0.0,0.0,0.0,0.0,8.64,0.0,0.0,0.0,3.7,6.17,1.23,0.0,0.0,3.7,1.23,0.0,3.7,1.23,1.23,0.0,3.7,2.47,1.23,0.0,0.0,2.47,0.0,0.0,2.47,0.0,0.0,7.41,7.41,0.0,28.4,2.47,16.05,12.35,0.0,0.0,1.23,0.0,0.0,0.0,1.23,1.23,0.0,0.0,0.0,0.0,12.35,6.17,0.0,1.23,0.0,0.0,0.0,0.0,0.0,4.94,0.0,0.0,2.5,2.6667,3.0,1.2,1.2,1.0,1.70892,1.84444,1.81327,0.85,11,5.150095238,0.04863636364,394,93,1,i ve been sleeping in my car for 37 months with only 4 more months until i m back on my feet i ve been staying in the same parking spot in the dark edge of a public parking lot every night last thursday night i m woken up by a cop banging on my window with his flashlight at 1 45am he said he helped someone in the same parking lot a week prior find a place to live i call bullshit on that
179,1505264333,9,7.345027322,176,34.35,14.01,90.81,6.67,44.0,13.64,90.34,60.23,15.91,8.52,7.39,0.0,0.0,0.0,1.14,7.39,7.39,13.64,11.36,7.39,9.09,3.41,19.89,5.68,0.57,2.84,1.7,1.14,6.25,2.27,3.98,1.7,0.57,0.0,6.82,0.0,0.0,0.0,0.0,15.34,2.84,1.14,2.84,6.82,1.7,6.82,2.27,1.14,0.0,1.14,1.7,0.57,1.14,0.0,0.0,6.25,0.57,1.14,1.14,1.14,2.27,2.27,15.34,1.7,14.77,1.7,4.55,8.52,1.14,0.0,0.0,0.0,0.0,0.0,0.0,0.0,0.0,0.0,0.0,0.0,10.23,1.7,1.7,0.0,0.0,0.57,0.0,0.0,0.0,3.98,2.27,0.0,2.9167,2.6923,3.0,1.0,1.1429,1.0,1.68895,1.46483,1.87294,1.0,3,7.815409836,0.1196736597,909,194,1,i get that three mistakes in a row is nothing new i ve seen coworkers make that many in a day i just can t shake the very strong feeling that this person may not be a safe person to be around and i have no idea if that is a helpful gut feeling or if it s a weird and new manifestation of the ptsd i ve never had this issue before previously people only triggered my ptsd when refusing to let me leave or when being quite physically aggressive obviously i am going to talk to the ptsd counselor about this to see what they think but i have to decide about this appointment by first thing tomorrow 13 5 hours from posting whether to trust them enough to keep the appointment or to cancel it for now so i don t risk getting kicked out from appointment mixups i d try in a new city in a couple months when i have a stable living situation is there a way to gauge if someone is unsafe or if i m paranoid?
409,1517092228,27,3.89490991,69,9.17,95.89,5.86,99.0,13.8,15.94,92.75,56.52,18.84,14.49,0.0,1.45,2.9,10.14,0.0,4.35,1.45,13.04,11.59,10.14,11.59,1.45,24.64,5.8,0.0,0.0,2.9,0.0,10.14,8.7,1.45,0.0,1.45,0.0,20.29,0.0,1.45,0.0,11.59,15.94,4.35,1.45,2.9,7.25,1.45,5.8,8.7,2.9,2.9,1.45,5.8,2.9,1.45,0.0,1.45,5.8,4.35,0.0,1.45,0.0,0.0,4.35,15.94,0.0,14.49,0.0,8.7,5.8,0.0,5.8,0.0,0.0,0.0,0.0,0.0,0.0,0.0,0.0,0.0,0.0,18.84,7.25,4.35,0.0,0.0,0.0,0.0,0.0,0.0,7.25,0.0,0.0,2.75,2.5455,3.0,1.2857,1.1429,1.0,1.68846,1.53455,1.90711,0.86,14,4.847027027,0.165,377,87,0,we ve been together for 4 years now living together for just over 1 he s a very sweet guy but at times he can seem childish he s always joking or making fun but he also seems very uninterested in things and to brutally honest if you saw his resting face you would think he doesn t care about anything it s so relaxed with heavy eyelids and he speaks in monotone quietly
637,1487273161,10,2.725819209,57,14.86,29.92,99.0,97.58,11.4,12.28,91.23,57.89,22.81,15.79,8.77,7.02,0.0,0.0,0.0,7.02,3.51,10.53,10.53,7.02,3.51,5.26,17.54,3.51,0.0,3.51,3.51,1.75,5.26,5.26,0.0,0.0,0.0,0.0,8.77,0.0,0.0,0.0,0.0,15.79,3.51,0.0,0.0,0.0,5.26,7.02,3.51,0.0,1.75,1.75,0.0,0.0,0.0,0.0,0.0,12.28,7.02,0.0,5.26,0.0,0.0,1.75,17.54,1.75,22.81,3.51,15.79,5.26,0.0,0.0,0.0,1.75,1.75,0.0,1.75,0.0,0.0,0.0,0.0,1.75,24.56,8.77,8.77,0.0,0.0,0.0,0.0,0.0,0.0,3.51,0.0,3.51,3.0,2.625,3.0,1.125,1.0,1.0,1.67858,1.51538,1.95217,0.99,11,4.245,0.352,307,67,0,i am not except the one that exists in my mind we our nation are at a very precarious point in our history all generations have said that i am sure but we surely can t feel comfortable when million dollar high rises go up around homeless encampments anyway that is my rant prayer i don t know what
261,1537939917,0,5.298846154,76,79.01,55.22,93.86,2.51,15.2,19.74,90.79,48.68,10.53,9.21,6.58,1.32,1.32,0.0,0.0,1.32,3.95,18.42,9.21,6.58,5.26,0.0,19.74,3.95,2.63,1.32,3.95,1.32,5.26,1.32,3.95,0.0,1.32,2.63,5.26,1.32,0.0,0.0,0.0,5.26,2.63,0.0,1.32,1.32,0.0,0.0,1.32,0.0,1.32,0.0,7.89,2.63,5.26,0.0,0.0,5.26,2.63,1.32,0.0,1.32,0.0,2.63,15.79,0.0,22.37,1.32,6.58,13.16,1.32,0.0,2.63,3.95,0.0,0.0,0.0,0.0,0.0,0.0,0.0,0.0,19.74,7.89,6.58,0.0,0.0,0.0,0.0,0.0,0.0,2.63,2.63,0.0,2.75,2.25,3.0,1.0,1.1429,1.0,1.6671,1.47419,1.8044,0.47,0,5.818461538,-0.10625,423,90,0,first i d like to say thank you for taking time to read and consider my post funds would go to gas medications rent etc currently we are a little short on rent i am in the seattle washington area i have suffered from chronic migraines for about 15 years now i have also suffered from occipital neuralgia which is trigeminal neuralgia s ugly sibling for some time and just diagnosed as of the last two years now
691,1538345593,1,4.859142857,99,12.85,9.47,58.07,4.86,19.8,16.16,95.96,62.63,25.25,19.19,14.14,0.0,0.0,0.0,5.05,6.06,5.05,12.12,12.12,5.05,5.05,6.06,21.21,2.02,2.02,0.0,1.01,2.02,4.04,1.01,3.03,0.0,0.0,1.01,11.11,0.0,0.0,0.0,0.0,17.17,3.03,1.01,5.05,7.07,2.02,4.04,3.03,0.0,1.01,1.01,8.08,2.02,5.05,0.0,2.02,10.1,1.01,1.01,6.06,1.01,2.02,0.0,16.16,5.05,6.06,3.03,2.02,1.01,3.03,0.0,0.0,2.02,0.0,0.0,0.0,0.0,0.0,0.0,0.0,0.0,16.16,5.05,4.04,1.01,0.0,0.0,0.0,0.0,0.0,6.06,0.0,0.0,2.75,2.8889,3.0,1.1111,1.125,1.0,1.71659,1.61412,1.91784,1.0,0,5.619761905,-0.25,499,121,1,all i have from them is a roof over a head and sometimes food that suits my diet they won t talk to me about my problem they won t lend me a hand to find a job they won t support me with my uni they won t even lend me a car to drive to doctors all i keep hearing is to go talk to doctors if i m ill and get antidepressants if i m depressed not realising that neither one will solve my problem so i thought that maybe someone could help me out with this maybe someone has similar experience
152,1517373552,24,4.594556962,74,10.79,5.26,99.0,2.3,14.8,14.86,93.24,58.11,25.68,17.57,17.57,0.0,0.0,0.0,0.0,8.11,4.05,9.46,13.51,5.41,6.76,0.0,22.97,6.76,2.7,1.35,0.0,1.35,5.41,1.35,4.05,1.35,0.0,1.35,2.7,0.0,0.0,1.35,0.0,4.05,0.0,1.35,0.0,1.35,0.0,1.35,1.35,1.35,0.0,0.0,9.46,4.05,4.05,0.0,4.05,2.7,0.0,1.35,1.35,0.0,1.35,5.41,18.92,0.0,20.27,0.0,9.46,9.46,1.35,1.35,0.0,0.0,0.0,0.0,0.0,0.0,0.0,0.0,0.0,0.0,18.92,6.76,5.41,0.0,0.0,0.0,0.0,0.0,0.0,6.76,0.0,0.0,2.625,2.625,3.0,1.0,1.1429,1.0,1.74531,1.63333,1.83754,0.9,10,6.404911392,0.04270833333,386,93,1,i m starting to eat far less and constantly poke at my fat starve compare myself to other girls and today i ve given into regurgitating and that has made me almost lose it i did mention in a previous post that i have a huge phobia of vomiting and i see that it s combatting my body dysmorphia now i m at my nerves end i do have times where i m calm and collected reading a book
475,1516146233,1,2.545175439,113,8.39,14.41,82.25,25.77,22.6,14.16,97.35,65.49,27.43,23.01,16.81,0.88,0.0,5.31,0.0,4.42,2.65,13.27,10.62,7.96,7.96,1.77,21.24,5.31,2.65,2.65,0.88,2.65,8.85,4.42,4.42,2.65,0.0,0.0,10.62,0.0,0.0,5.31,0.0,9.73,1.77,0.88,0.88,2.65,0.0,3.54,0.88,0.0,0.0,0.88,2.65,0.88,0.0,0.0,1.77,8.85,3.54,0.0,2.65,0.88,1.77,13.27,0.88,0.0,10.62,0.0,4.42,6.19,0.88,1.77,0.0,0.0,0.0,0.0,0.0,0.0,0.0,0.0,0.0,0.0,7.08,4.42,0.88,0.0,0.0,0.0,0.0,0.0,0.0,1.77,0.0,0.0,2.75,2.8,2.8,1.0,1.1429,1.0,1.72896,1.47963,1.94704,1.0,3,3.944736842,-0.0209280303,545,120,1,i was struggling to read the situation between us my head was telling me she liked me but my anxiety was telling me i was wrong about this and not to pursue any sort of romantic relationship with her i ended up getting a little drunk one night just before the new year and was texting her i realised how much more at ease i was talking to her when i was drunk and that i quite liked her i felt like i was being weird when i was sober too and i didn t like that so i decided that instead of hiding my anxiety i would open up to her about it
706,1533339158,3,4.515586957,114,50.93,43.02,96.09,13.81,22.8,16.67,92.98,56.14,20.18,14.91,10.53,0.0,0.0,4.39,0.0,5.26,4.39,15.79,6.14,5.26,7.89,0.88,14.04,5.26,4.39,1.75,4.39,1.75,6.14,2.63,3.51,0.0,2.63,0.0,13.16,3.51,0.88,2.63,5.26,8.77,3.51,0.0,0.0,1.75,0.88,2.63,0.88,0.88,0.0,0.0,2.63,0.88,0.88,0.88,0.88,7.89,2.63,1.75,3.51,0.88,0.88,13.16,2.63,0.0,19.3,0.88,9.65,9.65,0.88,1.75,0.0,0.0,0.0,0.0,0.88,0.88,0.0,0.0,0.0,0.0,9.65,4.39,4.39,0.0,0.0,0.0,0.0,0.0,0.0,0.88,0.0,0.0,2.8571,2.6667,3.0,1.0,1.0,1.0,1.74531,1.53333,1.83368,1.0,2,4.689293478,-0.1097222222,581,125,1,my daughter s father i was with for 5 years on and off he was not abusive the first year however when he became so i left and found out two weeks later i was pregnant of course he begged and pleaded for a second chance and i believed that my daughter deserved me to at least give it a shot i came back and surprise surprise it was worse than it ever was i stuck it out until he disappeared for the eleventeenth time on a drunken bender i checked my facebook to find some scumbag girl who was dating one of his best friends was posting horrific nasty way out shit about me
529,1515485628,2,6.392959184,90,17.96,18.71,98.69,1.0,18.0,14.44,97.78,61.11,25.56,17.78,12.22,2.22,1.11,2.22,0.0,7.78,0.0,18.89,10.0,7.78,4.44,4.44,21.11,4.44,3.33,4.44,1.11,3.33,6.67,1.11,5.56,3.33,2.22,0.0,8.89,0.0,0.0,0.0,2.22,15.56,0.0,3.33,0.0,3.33,4.44,4.44,1.11,1.11,0.0,0.0,0.0,0.0,0.0,0.0,0.0,13.33,4.44,1.11,3.33,2.22,2.22,1.11,18.89,0.0,20.0,3.33,5.56,12.22,1.11,1.11,0.0,1.11,0.0,0.0,3.33,0.0,0.0,0.0,0.0,3.33,23.33,5.56,6.67,0.0,0.0,0.0,0.0,0.0,2.22,8.89,0.0,0.0,2.7143,2.4545,3.0,1.0,1.1429,1.0,1.68403,1.48706,1.81888,0.75,3,7.466244898,-0.3285714286,477,111,1,i m too insecure not to make it into some sarcastic joke like bet you actually can t wait to get rid of me blah blah late august i m days from leaving and he s desperate for my time looking to meet me after work everyday and have me stay over i m unsure of what to make of all it which in retrospect is so stupid on my part i just can t stop denying things to myself anyway two nights before i m leaving he mentions how we ve never defined what our relationship is
28,1501335816,94,4.047810945,66,31.44,98.25,70.57,54.29,13.2,15.15,92.42,63.64,16.67,12.12,0.0,0.0,12.12,0.0,0.0,4.55,9.09,12.12,7.58,10.61,10.61,3.03,24.24,4.55,3.03,3.03,0.0,1.52,4.55,3.03,1.52,0.0,0.0,1.52,13.64,0.0,0.0,0.0,0.0,18.18,7.58,3.03,3.03,4.55,3.03,1.52,0.0,0.0,0.0,0.0,1.52,1.52,0.0,0.0,0.0,4.55,1.52,1.52,1.52,0.0,0.0,4.55,15.15,1.52,18.18,6.06,6.06,6.06,0.0,4.55,0.0,0.0,0.0,0.0,0.0,0.0,0.0,0.0,0.0,0.0,18.18,6.06,6.06,1.52,0.0,1.52,0.0,0.0,0.0,1.52,0.0,1.52,2.3333,2.75,3.0,1.125,1.1429,1.0,1.69569,1.47797,1.77161,0.99,12,4.263507463,-0.06,360,78,0,if it is negative don t reject the thought follow the thought as far as your mind wants to and move on when you notice another thought arise again this creates a barrier between you and your mind flow have you ever played a game where you are completely in the moment? maybe the ball was just thrown to you and your body seems to react automatically
7,1506028350,6,10.02995134,131,28.99,29.64,92.8,7.88,26.2,20.61,91.6,58.02,19.08,10.69,7.63,0.0,0.0,1.53,1.53,8.4,3.05,15.27,9.92,6.87,6.87,3.82,16.79,3.82,1.53,1.53,1.53,3.82,1.53,0.0,1.53,0.76,0.76,0.0,9.16,0.0,1.53,1.53,0.0,15.27,3.82,2.29,0.76,0.76,4.58,3.05,5.34,0.0,4.58,0.76,1.53,0.76,0.76,0.0,0.0,4.58,1.53,0.76,1.53,0.0,0.76,3.05,13.74,0.0,17.56,2.29,10.69,6.11,3.82,0.0,2.29,0.0,0.0,0.0,0.0,0.0,0.0,0.0,0.0,0.0,14.5,3.82,5.34,0.0,0.0,0.0,0.0,0.76,0.0,4.58,0.0,0.0,2.7143,2.8,3.0,1.0,1.1429,1.0,1.70439,1.50598,1.82334,0.88,6,9.593832117,0.03997668998,725,148,1,more specifically for example i live with roommates and i can t remember the last time it has been quiet in the apartment there s never a moment where it is completely silent and i know it s anxiety and sensory overload but gosh does it make me angry my roommates talk constantly and they keep me from being able to sleep because all i can concentrate on is their voices another example in one of my classes today my professor talked non stop and she s one of those extremely hyper fast talking off topic teachers who go off on tangents about things that aren t related to the lesson at all it was so hard to stay in that class without storming out because i couldn t handle listening to her loud voice any longer
130,1532958349,7,1.421612903,31,35.22,1.25,99.0,1.0,6.2,19.35,93.55,51.61,22.58,19.35,19.35,0.0,0.0,0.0,0.0,3.23,0.0,12.9,9.68,3.23,0.0,3.23,22.58,0.0,0.0,0.0,0.0,0.0,9.68,0.0,9.68,0.0,3.23,6.45,3.23,3.23,0.0,0.0,3.23,9.68,3.23,0.0,0.0,3.23,3.23,0.0,3.23,3.23,0.0,0.0,3.23,3.23,0.0,0.0,0.0,3.23,0.0,0.0,3.23,0.0,0.0,12.9,3.23,3.23,12.9,3.23,9.68,0.0,0.0,3.23,0.0,0.0,0.0,0.0,3.23,3.23,3.23,0.0,0.0,0.0,16.13,16.13,0.0,0.0,0.0,0.0,0.0,0.0,0.0,0.0,0.0,0.0,2.5833,2.7,3.0,1.1429,1.1429,1.0,1.8383,1.65926,1.84579,0.9,5,2.815096774,-0.1066666667,165,36,1,i woke up crying wtf is going on in my head that i dream such graphic scenes my abuse was mainly by my stepmom my dad was neglectful pretending nothing happened
340,1498196715,7,10.71704545,131,6.95,50.0,71.61,7.88,26.2,15.27,90.84,64.12,26.72,18.32,9.16,0.76,1.53,6.87,0.0,6.11,2.29,12.21,10.69,8.4,5.34,4.58,22.14,4.58,2.29,2.29,2.29,0.76,4.58,1.53,3.05,0.76,0.76,0.0,13.74,1.53,0.0,0.76,7.63,12.21,1.53,0.0,3.05,5.34,1.53,2.29,2.29,0.76,0.76,0.76,1.53,0.76,1.53,0.0,0.0,3.82,1.53,0.0,0.0,0.0,2.29,7.63,13.74,2.29,21.37,3.05,6.87,11.45,0.0,0.0,0.0,0.0,0.0,0.0,1.53,0.0,0.0,0.76,0.76,0.0,23.66,3.82,16.79,0.0,0.0,0.0,0.0,0.76,0.0,0.76,1.53,0.0,2.8333,2.625,3.0,1.0,1.0,1.0,1.74353,1.50175,1.90762,0.77,0,9.187818182,0.01525974026,696,158,1,we had few arguements then i stopped interacting with him i myself did feel that i was in the teenage phase where you start having problems with your dad i according to him was being irrational rash non docile difficult nothing like he had seen before haughty etc he even slapped me his 23 well i turned 24 this week year old daughter and then during the heat of moments he has not just once said that he wants me to go away that he doesnt want to have to do anything with me and he doesnt care where i go what i do so right now yes i have decided to go somewhere somewhere far somewhere obscure as somebody or rather nobody start a new life start with nothing
511,1523614289,1,6.6175,96,78.67,85.13,5.61,65.25,19.2,8.33,93.75,59.38,15.62,12.5,3.12,0.0,0.0,9.38,0.0,3.12,5.21,19.79,9.38,4.17,4.17,1.04,17.71,3.12,1.04,1.04,0.0,2.08,4.17,3.12,1.04,0.0,0.0,0.0,14.58,3.12,0.0,4.17,8.33,8.33,1.04,1.04,3.12,2.08,1.04,0.0,0.0,0.0,0.0,0.0,2.08,0.0,2.08,0.0,0.0,5.21,1.04,2.08,4.17,1.04,0.0,5.21,11.46,0.0,19.79,2.08,9.38,7.29,2.08,0.0,0.0,4.17,0.0,0.0,0.0,0.0,0.0,0.0,0.0,0.0,5.21,5.21,0.0,0.0,0.0,0.0,0.0,0.0,0.0,0.0,0.0,0.0,3.0,2.8889,3.0,1.0,1.1429,1.0,1.7137,1.58605,1.82689,0.52,0,6.402166667,0.08134920635,476,101,1,now my dad is doing his best to cope while trying to care for my niece who is special needs he has noone out in mississippi with him i need to go out there for a month and help him sort through all of moms things since she left behind a huge mess for him to deal with he is finding out that she was paying for accidental life insurance and there was no actual life insurance policy put into place the bills have been stacking the past few months and he just needs a break
204,1524771248,2,-0.26,39,86.39,22.08,46.75,97.19,7.8,10.26,94.87,56.41,15.38,10.26,10.26,0.0,0.0,0.0,0.0,5.13,12.82,15.38,5.13,5.13,5.13,2.56,17.95,5.13,0.0,2.56,5.13,0.0,5.13,5.13,0.0,0.0,0.0,0.0,7.69,0.0,0.0,0.0,0.0,12.82,2.56,2.56,2.56,2.56,2.56,2.56,2.56,0.0,2.56,0.0,2.56,2.56,0.0,0.0,0.0,7.69,0.0,0.0,7.69,0.0,0.0,7.69,10.26,0.0,7.69,2.56,2.56,2.56,0.0,5.13,0.0,0.0,5.13,0.0,0.0,0.0,0.0,0.0,0.0,0.0,15.38,10.26,5.13,0.0,0.0,0.0,0.0,0.0,0.0,0.0,0.0,0.0,2.8333,3.0,2.6,1.1429,1.1429,1.0,1.884,1.52903,1.89033,0.67,0,1.672512821,0.2083333333,187,45,0,the second half of a song called monsters by the band nofx a favorite of mine it seems appropriate i never had the guts to do it but god how i wanted to run off god give me strength
403,1515368064,7,3.899104478,66,64.89,81.84,41.42,99.0,13.2,16.67,93.94,56.06,18.18,12.12,3.03,1.52,0.0,7.58,0.0,6.06,6.06,15.15,7.58,4.55,6.06,0.0,21.21,6.06,1.52,0.0,0.0,1.52,9.09,7.58,1.52,0.0,0.0,0.0,15.15,0.0,0.0,9.09,0.0,16.67,1.52,1.52,4.55,3.03,1.52,4.55,3.03,0.0,0.0,1.52,7.58,0.0,1.52,3.03,1.52,9.09,6.06,1.52,1.52,0.0,0.0,12.12,4.55,0.0,22.73,4.55,9.09,10.61,1.52,0.0,0.0,0.0,0.0,0.0,1.52,0.0,0.0,1.52,0.0,0.0,18.18,7.58,10.61,0.0,0.0,0.0,0.0,0.0,0.0,0.0,0.0,0.0,3.0,2.6364,3.0,1.125,1.1429,1.0,1.80362,1.66102,1.8613,0.74,7,4.430029851,0.2716049383,343,79,0,met a girl at a work convention and really hit it off started dating and really moved fast it felt like true love the sex was awesome she was so sweet a few months in she started zeroing in on anything she did not like and would use anything she could against me she would ignore my texts for periods of time our sex life went down
