337,1531455290,5,5.944456522,91,7.51,29.12,70.18,1.0,18.2,12.09,96.7,64.84,25.27,19.78,13.19,1.1,0.0,5.49,0.0,5.49,2.2,12.09,13.19,5.49,9.89,1.1,25.27,2.2,2.2,1.1,0.0,2.2,10.99,2.2,8.79,6.59,0.0,1.1,13.19,0.0,0.0,0.0,5.49,20.88,5.49,2.2,4.4,5.49,2.2,5.49,4.4,0.0,1.1,3.3,0.0,0.0,0.0,0.0,0.0,6.59,3.3,0.0,2.2,0.0,1.1,0.0,20.88,1.1,9.89,2.2,8.79,1.1,0.0,0.0,0.0,0.0,0.0,0.0,0.0,0.0,0.0,0.0,0.0,0.0,8.79,4.4,2.2,0.0,0.0,0.0,1.1,0.0,0.0,1.1,0.0,0.0,2.8462,2.8,2.8,1.0,1.0,1.0,1.70044,1.41176,1.93659,0.86,4,8.131652174,0.05138888889,452,99,1,it is having a major strain on our relationship as he obviously wants to be involved but essentially i am unloading all my worry onto him i am really unsure how to move forwards from here if i think i am being irrational and hold in my anxiety he says i am not communicating with him about it if i open up and tell him i feel like i am a burden and it makes me feel guilty and pretty low that i m feeling this way any advice would be appreciated!
611,1518480571,5,9.866538462,175,10.21,32.39,98.94,11.11,35.0,13.71,96.0,64.57,26.29,17.14,12.0,1.71,0.0,3.43,0.0,9.14,4.57,12.0,6.86,8.57,10.86,2.29,16.57,2.86,1.71,2.86,0.0,1.14,5.71,2.29,3.43,2.86,1.14,0.0,12.57,0.0,0.0,0.0,6.29,18.29,6.29,4.57,0.0,2.86,0.57,4.57,2.29,0.0,0.0,1.71,0.57,0.0,0.0,0.0,0.57,6.29,3.43,1.14,1.71,0.57,0.57,2.86,14.29,1.14,15.43,2.86,4.0,8.57,0.57,0.0,0.0,0.0,0.0,0.0,0.0,0.0,0.0,0.0,0.0,0.0,17.14,2.86,6.29,0.0,0.0,0.0,0.0,1.71,2.29,4.0,0.0,0.0,2.7143,2.8,3.0,1.0,1.0,1.0,1.69703,1.50943,1.85778,0.78,8,9.851098901,0.1283333333,905,203,1,i hadn t realized until a year ago but this gave me ptsd and shaped the way i interact with men and boys now i m dating a boy who is very sweet very understanding and such but i often find myself thinking about ending it because his behavior feels too man ish to me and it makes me uncomfortable and scares me it puts me in a very irritated state a response to feeling threatened by men in my case and often starts discourse between us luckily he is very understanding and we talked about it a lot but whenever he asks me what he s doing that makes me uncomfortable i can t answer i can t put it into words which means he can t change his behavior perfectly and that the cycle will start over again i m fighting as hard as i can against the effects of my ptsd on my relationship as it is very important to me to make it work but i know when we end it it will be partly caused by it
469,1483357819,5,12.9095625,150,5.16,10.28,76.49,2.41,30.0,17.33,96.67,59.33,24.0,16.67,12.0,0.0,0.0,3.33,1.33,7.33,2.67,9.33,8.0,7.33,11.33,4.67,14.0,7.33,4.0,3.33,1.33,2.0,13.33,5.33,8.0,2.67,2.67,1.33,16.0,2.0,0.67,0.0,5.33,18.67,0.67,2.67,0.67,5.33,1.33,10.67,2.67,0.0,1.33,1.33,2.67,0.67,0.67,0.67,0.0,10.0,2.67,0.67,6.0,2.0,0.0,0.0,15.33,0.67,6.0,0.67,4.0,1.33,0.0,2.0,0.67,0.0,0.0,0.0,2.0,1.33,0.0,0.0,0.67,0.0,22.0,2.67,10.67,0.0,0.0,0.67,0.0,0.0,0.0,6.67,1.33,0.0,3.0,3.0,3.0,1.0,1.125,1.0,1.7828,1.55606,1.87854,1.0,4,12.0825,-0.0756547619,795,183,1,well maybe afraid isn t the best word but it s not far off i m not worried they can physically harm me or anything nor do i even hate kids most kids i actually like but certain kids like uncle s girlfriend s one kids make me uncomfortable and make my anxiety go off badly he s like 6 or something like that but he is disrespectful to me and harasses me when i m around he ll make smart ass remarks which although typical small child insults get to me not because they hurt my feelings so much but it gets to me that i m so pathetic i can t even demand respect from a fucking child today playing some backyard cricket with my brother and other cousin a very respectful kid who i love he asks if he can peg the ball at my groin to which i obviously say no so what does he do?
462,1501523054,2,4.437142857,77,98.22,96.52,85.21,49.97,15.4,11.69,89.61,51.95,9.09,9.09,2.6,5.19,0.0,0.0,1.3,0.0,10.39,20.78,6.49,2.6,3.9,0.0,15.58,5.19,3.9,0.0,0.0,6.49,1.3,1.3,0.0,0.0,0.0,0.0,15.58,0.0,3.9,1.3,2.6,1.3,0.0,0.0,0.0,1.3,0.0,0.0,3.9,2.6,1.3,0.0,0.0,0.0,0.0,0.0,0.0,12.99,9.09,0.0,1.3,2.6,0.0,11.69,1.3,0.0,24.68,6.49,10.39,7.79,0.0,3.9,0.0,0.0,0.0,0.0,0.0,0.0,0.0,0.0,0.0,0.0,10.39,6.49,2.6,0.0,0.0,0.0,0.0,1.3,0.0,0.0,0.0,0.0,2.8333,3.0,3.0,1.1429,1.25,1.0,1.79939,1.7,1.84119,0.76,5,4.974441558,0.06902356902,382,85,0,i let out a loud whistle as we often invited new comers to go ride the guy on the black bike was named devin devin had just moved to town a couple weeks prior and had posted in our facebook group looking for friends to ride with after talking for a couple more minutes we took off on our adventure a couple blocks down a guy and girl were cruising on a gsxr i waved to them
362,1517338490,0,1.869264069,73,49.86,75.34,98.57,1.0,14.6,10.96,95.89,63.01,19.18,13.7,5.48,6.85,0.0,1.37,0.0,5.48,9.59,16.44,13.7,5.48,6.85,1.37,21.92,5.48,1.37,2.74,0.0,4.11,4.11,0.0,4.11,1.37,0.0,1.37,12.33,0.0,0.0,1.37,0.0,15.07,2.74,2.74,1.37,2.74,0.0,5.48,1.37,0.0,1.37,0.0,0.0,0.0,0.0,0.0,0.0,20.55,9.59,0.0,9.59,0.0,1.37,9.59,12.33,0.0,23.29,0.0,16.44,6.85,5.48,0.0,0.0,1.37,0.0,0.0,0.0,0.0,0.0,0.0,0.0,0.0,12.33,6.85,1.37,0.0,0.0,0.0,0.0,0.0,0.0,4.11,0.0,0.0,2.6,2.4,2.8,1.1111,1.0,1.0,1.61723,1.65574,1.80584,0.2,11,3.973441558,-0.00375,355,82,0,i know about the whole insecurity thing ive delt with it for over a year which is roughly how long we ve been together she is a senior in high school and i am a freshman in colllege so we spend a lot of time apart in high school since we were together a lot i d say it was worse we broke up for a short while but realized we didn t actually want to
629,1491157630,3,9.244880952,140,61.45,66.59,8.75,25.77,28.0,14.29,88.57,63.57,20.0,10.71,4.29,1.43,1.43,2.14,1.43,9.29,8.57,15.0,8.57,3.57,5.0,2.86,17.14,1.43,0.71,2.14,0.71,3.57,4.29,2.14,2.14,0.0,0.0,0.71,11.43,0.71,0.0,2.86,0.0,9.29,2.14,0.0,1.43,4.29,0.0,2.86,1.43,0.0,1.43,0.0,3.57,0.0,3.57,0.0,0.0,7.14,2.86,0.71,2.86,0.0,0.71,4.29,10.71,0.0,7.14,0.71,3.57,2.86,1.43,0.0,0.0,1.43,0.0,0.0,0.0,0.0,0.0,0.0,0.0,0.0,7.86,3.57,2.14,0.0,0.0,0.71,0.0,0.0,0.0,0.0,1.43,0.0,3.0,2.8,3.0,1.1111,1.1429,1.0,1.67208,1.36607,1.78952,0.59,2,7.922857143,0.08883928571,715,151,0,my wife suffers from chronic migraines of which she is allergic to most of the medications they have out there for this our options for relief comes in the form of methadone that is the only thing that helps i know what a lot of you are thinking and no we do not do drugs or anything that the stigma of methadone has with it i paid for her meds no problem for a while while she was filing for disability which many of you know is a very lengthy process while i was working there i heard rumors that there was a commission system set up for vip hosts that includes giving the surcharges of the bottle sales to the vip host i asked each manager and none of them could say one way or the other strange right?
371,1522859252,9,4.926842105,93,35.22,19.49,93.53,25.77,18.6,8.6,94.62,63.44,21.51,15.05,11.83,0.0,0.0,3.23,0.0,6.45,3.23,19.35,12.9,4.3,8.6,1.08,23.66,3.23,4.3,0.0,1.08,1.08,4.3,2.15,2.15,0.0,0.0,0.0,6.45,0.0,2.15,3.23,0.0,10.75,4.3,1.08,0.0,3.23,0.0,2.15,1.08,0.0,0.0,1.08,1.08,0.0,1.08,0.0,0.0,7.53,1.08,0.0,2.15,2.15,2.15,5.38,17.2,2.15,15.05,1.08,7.53,6.45,2.15,0.0,1.08,0.0,0.0,0.0,0.0,0.0,0.0,0.0,0.0,0.0,9.68,5.38,2.15,0.0,0.0,0.0,0.0,0.0,0.0,2.15,0.0,0.0,2.75,2.5455,3.0,1.1667,1.0,1.0,1.71897,1.53953,1.89257,1.0,8,6.228421053,-0.03125,439,104,1,good news is that my application for public housing was accepted bad news is that it will take up to six months for anything to open up for me more bad news is that i didn t know until today that my friend had to report me living with her to her landlady as soon as possible and because she waited so long i am an unauthorized guest so i have to be out today i think i have a place to go but i just feel like i ve sort of hit a wall
512,1538269909,5,7.472692308,78,3.37,1.0,98.01,1.0,19.5,24.36,88.46,55.13,16.67,12.82,12.82,0.0,0.0,0.0,0.0,3.85,1.28,5.13,11.54,7.69,12.82,3.85,17.95,7.69,5.13,0.0,0.0,3.85,10.26,2.56,7.69,2.56,0.0,1.28,2.56,0.0,0.0,0.0,0.0,28.21,2.56,0.0,6.41,10.26,5.13,12.82,8.97,2.56,0.0,5.13,2.56,0.0,2.56,0.0,0.0,2.56,0.0,0.0,0.0,0.0,2.56,8.97,5.13,1.28,11.54,1.28,2.56,7.69,0.0,0.0,0.0,0.0,0.0,0.0,1.28,0.0,0.0,1.28,0.0,0.0,23.08,5.13,12.82,0.0,0.0,0.0,0.0,0.0,0.0,0.0,0.0,5.13,2.375,2.7143,3.0,1.0,1.0,1.0,1.79523,1.3942,1.84069,1.0,1,7.482564103,-0.04653846154,471,96,1,lately i have started having some unusual episodes introduction i have never had flashbacks as far as i know but i was always upset every time somebody unexpectedly grabbed me or worse inflicted me some pain even if accidentally if i saw that coming than ok but if not i was instantly teleported to a very bad place emotionally i was not experiencing something i could call flashbacks but there sure were very dark painful and overwhelming feelings
328,1522355204,49,2.2216,48,84.57,14.87,91.31,99.0,9.6,16.67,79.17,45.83,8.33,4.17,4.17,0.0,0.0,0.0,0.0,4.17,6.25,14.58,8.33,2.08,6.25,2.08,16.67,2.08,0.0,2.08,2.08,6.25,6.25,6.25,0.0,0.0,0.0,0.0,2.08,0.0,0.0,0.0,0.0,12.5,2.08,0.0,0.0,4.17,2.08,4.17,0.0,0.0,0.0,0.0,2.08,0.0,2.08,0.0,0.0,2.08,0.0,0.0,0.0,2.08,0.0,0.0,16.67,0.0,18.75,6.25,10.42,2.08,0.0,4.17,0.0,4.17,0.0,0.0,2.08,2.08,0.0,0.0,0.0,0.0,29.17,8.33,8.33,0.0,0.0,2.08,0.0,2.08,0.0,2.08,4.17,2.08,2.8462,3.0,2.8,1.125,1.1818,1.0,1.81384,1.54286,1.85337,0.87,26,3.65,0.05246212121,256,60,0,i travel between nj to nyc often and 2 75 each way is pretty expensive nj and nyc both have disabled rates for public transport but the path which travels in between does not it s total bullshit a free place to live in nyc? a bold plea i realize
248,1540594163,0,4.309622642,52,32.33,91.08,38.39,25.77,10.4,23.08,94.23,61.54,19.23,13.46,3.85,3.85,0.0,5.77,0.0,5.77,7.69,11.54,9.62,7.69,7.69,1.92,13.46,3.85,3.85,0.0,0.0,3.85,7.69,3.85,3.85,1.92,1.92,0.0,21.15,0.0,0.0,5.77,0.0,15.38,0.0,1.92,0.0,3.85,3.85,5.77,3.85,3.85,0.0,0.0,0.0,0.0,0.0,0.0,0.0,21.15,15.38,1.92,5.77,0.0,0.0,7.69,3.85,0.0,15.38,1.92,9.62,5.77,1.92,11.54,0.0,0.0,0.0,0.0,0.0,0.0,0.0,0.0,0.0,0.0,19.23,9.62,5.77,0.0,0.0,0.0,0.0,1.92,0.0,1.92,0.0,0.0,2.6,2.8571,2.6,1.0,1.0,1.0,1.76369,1.50698,1.87431,0.45,3,5.464754717,-0.185,289,60,0,she and i are gamers and we both play similar games together often it was a part of our bond however looking back her relationship to the game was extremely obsessive moreso than anything i ve seen she literally did nothing but play that game in the weeks leading up to the assault
687,1515840601,6,6.823939394,75,32.98,94.5,10.08,1.0,15.0,21.33,98.67,57.33,14.67,10.67,2.67,0.0,0.0,8.0,0.0,4.0,5.33,13.33,10.67,9.33,8.0,2.67,21.33,6.67,0.0,1.33,1.33,2.67,8.0,1.33,5.33,1.33,2.67,0.0,28.0,1.33,0.0,9.33,0.0,17.33,2.67,0.0,0.0,6.67,4.0,6.67,4.0,1.33,2.67,0.0,0.0,0.0,0.0,0.0,0.0,6.67,2.67,0.0,2.67,0.0,1.33,2.67,18.67,1.33,9.33,1.33,0.0,8.0,1.33,0.0,0.0,0.0,0.0,0.0,0.0,0.0,0.0,0.0,0.0,0.0,13.33,6.67,4.0,0.0,0.0,0.0,0.0,0.0,0.0,2.67,0.0,0.0,2.6667,2.8571,3.0,1.0,1.1818,1.0,1.76199,1.54921,1.87059,1.0,9,7.498116883,-0.1079365079,439,87,0,my mother has always been a difficult person to talk with she is extremely stubborn and i have never seen her consider another person s suggestion or opinion she usually considers helpful advice or offers of assistance to be personal attacks when having a conversation she doesn t listen to the other person but only waits for her next turn to speak she tends to obsess about a single topic and will refuse talk about anything else
618,1541358299,12,7.718333333,107,36.76,3.81,98.2,5.67,21.4,21.5,98.13,54.21,18.69,9.35,9.35,0.0,0.0,0.0,0.0,9.35,1.87,13.08,6.54,4.67,7.48,2.8,18.69,3.74,0.0,0.0,0.0,2.8,7.48,2.8,4.67,0.93,0.93,0.0,5.61,0.0,0.0,0.0,0.0,23.36,0.93,4.67,3.74,7.48,0.0,11.21,2.8,0.0,0.0,2.8,4.67,0.0,4.67,0.0,0.0,15.89,0.93,6.54,4.67,1.87,3.74,8.41,7.48,0.93,15.89,0.93,8.41,6.54,7.48,0.0,0.0,0.93,0.0,1.87,0.0,0.0,0.0,0.0,0.0,0.0,12.15,3.74,6.54,0.0,0.0,0.93,0.0,0.0,0.0,0.93,0.0,0.0,2.8889,2.8571,3.0,1.0,1.1429,1.0,1.85143,1.53196,1.90657,0.94,3,7.054074074,0.04338383838,580,121,1,i am still rather lacking in social skills writing this is gradually helping me calm down does anybody else feel this way too? several years ago i just gave up on life not in the way suicidal people do but i just stopped putting in any effort to achieve any goals or plans since it wasn t working i stopped standing up for myself or resisting other people i stopped doing anything that was hard or required effort or that caused me emotional pain that triggered panic attacks not because i wanted to die but because i wanted to live to live a life free of those burdens
603,1520281745,6,0.06697674419,43,94.84,17.61,99.0,25.77,8.6,6.98,81.4,48.84,9.3,6.98,6.98,0.0,0.0,0.0,0.0,2.33,6.98,18.6,9.3,2.33,2.33,0.0,11.63,4.65,2.33,0.0,4.65,2.33,0.0,0.0,0.0,0.0,0.0,0.0,0.0,0.0,0.0,0.0,0.0,13.95,2.33,0.0,2.33,6.98,0.0,2.33,2.33,0.0,2.33,0.0,6.98,6.98,0.0,0.0,0.0,0.0,0.0,0.0,0.0,0.0,0.0,6.98,2.33,0.0,27.91,6.98,11.63,13.95,0.0,0.0,0.0,0.0,0.0,0.0,0.0,0.0,0.0,0.0,0.0,0.0,16.28,11.63,2.33,2.33,0.0,0.0,0.0,0.0,0.0,0.0,0.0,0.0,2.7143,2.375,3.0,1.1429,1.0,1.0,1.62818,1.65143,1.85605,0.88,1,0.387255814,0.325,206,50,0,my own sleep issues were that of a cat i could sleep anywhere anytime for brief at most 40 minute slots of time i was known to lean against a wall and be fast asleep on a 20 minute taxi ride boom out
546,1515159120,407,5.529642857,79,61.38,69.37,94.09,49.32,15.8,13.92,89.87,54.43,18.99,12.66,5.06,3.8,0.0,3.8,0.0,5.06,3.8,18.99,6.33,7.59,3.8,2.53,13.92,6.33,2.53,0.0,6.33,1.27,1.27,1.27,0.0,0.0,0.0,0.0,13.92,0.0,1.27,3.8,0.0,7.59,0.0,0.0,0.0,2.53,0.0,5.06,0.0,0.0,0.0,0.0,0.0,0.0,0.0,0.0,0.0,12.66,8.86,0.0,2.53,2.53,0.0,7.59,8.86,1.27,24.05,2.53,8.86,12.66,2.53,0.0,5.06,8.86,0.0,0.0,0.0,0.0,0.0,0.0,0.0,0.0,22.78,6.33,6.33,0.0,0.0,0.0,0.0,1.27,0.0,2.53,2.53,3.8,2.7778,2.8889,3.0,1.2308,1.0,1.0,1.67536,1.53231,1.85349,0.94,77,5.85247619,0.1764204545,421,95,0,i have been dating my girlfriend for around 1 5 years now we moved in together 3 months ago i paid for the renovation costs new furniture and countless other items to get us started totalling somewhere near 4000 she gave me about 200 to help with these costs during the initial move in our rent is only 240 a month no lease so it s more than feasible for her to pay it but she isn t great at managing money
694,1500024094,5,2.320904762,85,26.21,50.0,91.95,47.53,21.25,9.41,92.94,54.12,24.71,20.0,12.94,2.35,0.0,4.71,0.0,4.71,4.71,10.59,7.06,4.71,4.71,3.53,15.29,4.71,2.35,0.0,1.18,1.18,8.24,4.71,3.53,0.0,2.35,1.18,20.0,1.18,4.71,1.18,5.88,15.29,3.53,0.0,2.35,2.35,3.53,5.88,2.35,0.0,0.0,1.18,3.53,1.18,0.0,2.35,0.0,11.76,9.41,1.18,2.35,1.18,0.0,10.59,7.06,0.0,14.12,0.0,4.71,9.41,1.18,0.0,0.0,0.0,0.0,0.0,1.18,0.0,1.18,0.0,0.0,0.0,28.24,5.88,8.24,0.0,0.0,0.0,0.0,0.0,2.35,5.88,4.71,1.18,3.0,2.5,3.0,1.125,1.1429,1.0,1.70671,1.6303,1.97589,1.0,0,4.633174603,0.04246031746,433,111,0,hi everyone also posted on r rapecounseling sorry for my english it s not my mother tongue past few months were pretty rough and i think i m finally ready to write it down like if i needed it i was raped by a friend let s call him l the exact day i met my actual boyfriend let s call him n 5 years ago l wasn t really a friend of mine i never appreciated him but he was closely related to my best friend at the time
562,1523910868,33,-0.2956512605,65,89.32,32.23,86.77,25.77,10.83,10.77,81.54,46.15,13.85,9.23,9.23,0.0,0.0,0.0,0.0,4.62,10.77,12.31,6.15,1.54,4.62,0.0,13.85,9.23,3.08,0.0,4.62,3.08,3.08,1.54,1.54,0.0,0.0,0.0,4.62,1.54,1.54,3.08,0.0,6.15,1.54,0.0,0.0,4.62,0.0,0.0,3.08,0.0,1.54,1.54,0.0,0.0,0.0,0.0,0.0,12.31,0.0,3.08,9.23,3.08,0.0,7.69,4.62,0.0,16.92,1.54,15.38,0.0,0.0,0.0,4.62,0.0,0.0,0.0,1.54,0.0,0.0,0.0,0.0,0.0,20.0,9.23,6.15,0.0,0.0,0.0,0.0,0.0,0.0,3.08,0.0,1.54,2.8889,2.6667,3.0,1.1429,1.125,1.0,1.73946,1.82353,1.8562,0.97,8,1.733865546,-0.01194444444,308,77,0,i left grandma s and i got a tent it s pretty big i got it for 30 off some dude high on h i have a queen size mattress on pallets and two small dressers two folding chairs a cooler a shelf a speaker box with wood on top for a table i found some carpet so i put that down the weather has been crazy
160,1516769416,186,2.851710526,91,30.93,90.62,3.23,1.1,18.2,10.99,93.41,51.65,19.78,14.29,2.2,1.1,0.0,10.99,0.0,5.49,7.69,8.79,8.79,6.59,7.69,1.1,16.48,7.69,3.3,2.2,2.2,5.49,3.3,0.0,3.3,0.0,0.0,0.0,17.58,3.3,1.1,4.4,10.99,12.09,1.1,1.1,1.1,1.1,5.49,2.2,1.1,1.1,0.0,0.0,1.1,0.0,0.0,0.0,1.1,7.69,3.3,2.2,2.2,0.0,0.0,1.1,13.19,3.3,16.48,3.3,7.69,5.49,3.3,0.0,4.4,2.2,1.1,0.0,1.1,0.0,0.0,1.1,0.0,0.0,9.89,5.49,2.2,0.0,0.0,0.0,0.0,0.0,0.0,2.2,0.0,0.0,2.8333,2.625,3.0,1.0,1.125,1.0,1.74283,1.82105,1.80501,0.95,85,3.077039474,-0.1596428571,467,101,1,my mom is a single mom working two shifts every day and she cannot wrangle a full grown man like my brother anymore so she lets him do what he wants as long as he can pay a small piece of rent so he works with friends doing god knows what he s home around 2pm every day and he will always tear apart the fridge looking for food microwave some gross stuff then drop the dirty plates in the sink he makes such a mess everywhere he goes it s absolutely disgusting
313,1536124311,4,4.928518519,81,22.96,10.86,84.78,10.27,16.2,13.58,92.59,64.2,20.99,17.28,14.81,0.0,0.0,1.23,1.23,3.7,4.94,14.81,14.81,6.17,7.41,1.23,14.81,3.7,2.47,2.47,0.0,1.23,3.7,1.23,2.47,2.47,0.0,0.0,6.17,1.23,0.0,2.47,0.0,9.88,1.23,3.7,0.0,0.0,2.47,2.47,4.94,0.0,0.0,1.23,2.47,1.23,1.23,0.0,0.0,4.94,1.23,1.23,2.47,1.23,0.0,2.47,12.35,0.0,9.88,0.0,7.41,2.47,2.47,1.23,0.0,0.0,0.0,0.0,0.0,0.0,0.0,0.0,0.0,0.0,6.17,6.17,0.0,0.0,0.0,0.0,0.0,0.0,0.0,0.0,0.0,0.0,2.8,2.8889,3.0,1.0,1.1429,1.0,1.7179,1.51111,1.83997,1.0,1,6.315654321,-0.1625,399,86,1,as of sunday i have experience sever anxiety its too the point i am unable to do normal everyday functions and doing my job is harder all i can think about is how i was ripped away from my daughter and how she is without me its to the point my therapist uas suggested i used cbd oil to manage my anxiety instead of narcotics they help take the edge off and let me relax to the point i can sleep
89,1502138440,2,0.3060784314,67,61.48,14.8,83.59,1.67,13.4,4.48,98.51,65.67,19.4,13.43,10.45,0.0,2.99,0.0,0.0,5.97,7.46,17.91,11.94,2.99,4.48,2.99,19.4,2.99,1.49,1.49,2.99,1.49,2.99,0.0,2.99,2.99,0.0,0.0,4.48,0.0,0.0,0.0,0.0,11.94,0.0,0.0,2.99,2.99,1.49,4.48,1.49,0.0,0.0,0.0,1.49,0.0,1.49,0.0,0.0,5.97,0.0,2.99,1.49,1.49,0.0,1.49,16.42,1.49,14.93,1.49,4.48,8.96,5.97,0.0,0.0,0.0,0.0,0.0,1.49,0.0,1.49,0.0,0.0,0.0,20.9,8.96,7.46,0.0,0.0,2.99,0.0,0.0,0.0,1.49,0.0,0.0,2.8333,2.625,2.6,1.0,1.3333,1.0,1.74173,1.42034,1.83794,1.0,8,3.232941176,0.09,312,78,0,btw i am only an exec i am afraid to have a gap in my cv but for once in my life i want not to worry for a bit of course during the next period i will apply to jobs but i don t want to rush and take the first offer anyhow have you ever experienced something like this? what did you do to overcome it?
242,1516975338,3,6.852653061,133,2.47,4.2,98.31,99.0,26.6,14.29,96.99,66.17,27.82,20.3,14.29,0.0,0.0,3.76,2.26,7.52,3.01,12.03,9.77,9.77,9.77,6.02,19.55,3.01,2.26,0.75,0.0,0.75,9.02,7.52,1.5,0.0,1.5,0.0,12.03,0.75,0.75,0.0,3.76,27.07,4.51,3.76,1.5,3.01,6.02,9.02,1.5,0.0,0.0,0.75,3.76,0.0,0.0,1.5,0.0,6.77,5.26,1.5,0.75,0.0,0.0,1.5,15.79,0.75,11.28,1.5,4.51,5.26,0.75,1.5,0.75,0.0,0.0,0.0,0.0,0.0,0.0,0.0,0.0,0.0,20.3,3.76,6.77,0.0,0.0,0.0,0.0,0.75,0.0,9.02,0.0,0.0,3.0,2.875,3.0,1.0,1.125,1.0,1.70688,1.38017,1.96171,0.67,10,8.092517007,0.45,703,160,0,i can t guarantee that i will never change my mind but i ve never dreamt of happily ever after i don t really believe in eternal love and soulmates and all this stuff so i guess it s not really likely i m not asexual or aromantic i love sex and i love him in a non platonic way i just can t compromise on that kind of thing i wouldn t even know how to do it i could meet his family pretend to like them pretend to bond with them and pretend to care but that s really just lying to make him happy i ve tried it before and it makes me hating myself and them i ve always told him the the truth about the level of commitment i m comfortable with but nevertheless i feel like i m leading him on
535,1515813254,3,3.312439024,78,4.96,3.66,92.13,1.0,15.6,8.97,98.72,65.38,24.36,19.23,11.54,2.56,0.0,5.13,0.0,5.13,1.28,12.82,10.26,10.26,6.41,6.41,24.36,6.41,2.56,2.56,0.0,5.13,6.41,1.28,5.13,0.0,0.0,2.56,10.26,0.0,0.0,5.13,0.0,30.77,5.13,2.56,5.13,3.85,1.28,12.82,6.41,0.0,0.0,6.41,1.28,0.0,1.28,0.0,0.0,2.56,2.56,0.0,0.0,0.0,0.0,3.85,16.67,1.28,10.26,2.56,5.13,2.56,1.28,0.0,0.0,0.0,0.0,0.0,0.0,0.0,0.0,0.0,0.0,0.0,19.23,6.41,7.69,0.0,0.0,0.0,0.0,0.0,0.0,5.13,0.0,0.0,2.7143,2.6667,2.6,1.1111,1.1429,1.0,1.72544,1.4,1.89143,0.8,5,4.476731707,-0.05170454545,376,97,0,i didn t tell her my feelings because i value her too much but do not want to hurt her i just want to let go of all my feelings but i can t there s only a few days left at school after which we might go our different ways but i have this strange feeling inside that i do not want to live in any sort of regret about not telling her how i felt it s just really weird
47,1516672473,8,2.721666667,86,6.37,2.45,97.26,69.6,21.5,10.47,96.51,65.12,26.74,18.6,15.12,0.0,0.0,3.49,0.0,8.14,2.33,16.28,10.47,5.81,11.63,5.81,23.26,8.14,5.81,3.49,1.16,1.16,6.98,4.65,2.33,0.0,1.16,0.0,10.47,1.16,1.16,3.49,1.16,25.58,5.81,1.16,2.33,6.98,1.16,9.3,2.33,0.0,0.0,2.33,0.0,0.0,0.0,0.0,0.0,9.3,3.49,3.49,2.33,1.16,1.16,3.49,18.6,1.16,8.14,0.0,4.65,3.49,0.0,0.0,0.0,0.0,0.0,1.16,1.16,0.0,0.0,0.0,0.0,1.16,19.77,4.65,3.49,0.0,0.0,0.0,0.0,0.0,0.0,6.98,2.33,2.33,2.8462,2.625,3.0,1.125,1.2222,1.0,1.71069,1.42278,1.89592,0.9,10,4.113913043,0.1138888889,418,101,0,i ll try to keep this short i ve never been able to feel empathy towards other people i m not a sociopath or anything as far as i know i know when i should feel bad for with somebody but i can t make myself care as much as i want to anyways my mothers best friend of 45 years just killed himself and she s pretty torn up about it i gave her a hug and what not but i have no idea what else i m supposed to do
309,1523696616,2,4.567380952,98,19.28,95.85,65.98,4.76,19.6,7.14,96.94,65.31,28.57,23.47,10.2,1.02,7.14,5.1,0.0,5.1,3.06,14.29,11.22,4.08,6.12,0.0,21.43,8.16,4.08,0.0,0.0,0.0,2.04,0.0,2.04,0.0,2.04,0.0,21.43,0.0,1.02,0.0,6.12,8.16,0.0,2.04,2.04,0.0,3.06,1.02,8.16,2.04,2.04,4.08,5.1,3.06,0.0,1.02,1.02,4.08,1.02,0.0,3.06,0.0,0.0,5.1,7.14,3.06,19.39,3.06,12.24,6.12,0.0,0.0,2.04,0.0,0.0,0.0,2.04,1.02,0.0,1.02,0.0,0.0,10.2,4.08,3.06,0.0,0.0,0.0,1.02,0.0,2.04,0.0,0.0,0.0,2.7778,2.8,3.0,1.1429,1.0,1.0,1.72267,1.72444,1.87079,1.0,14,4.626938776,-0.07962962963,478,108,1,before i could tell erik we should go outside he threw me back onto the bed saying yeah you will make a deal you will show me everything that you do behind my back you fucking liar you are always on your phone talking to guys and now you will show me everything! erik had me on my bed laying pushed against the wall while he laid down on me with his full body weight his body is so big and heavy it was making it harder and harder for me to breath as he was crushing me
137,1540085087,7,-0.3126506024,77,9.38,3.48,99.0,2.61,15.4,11.69,94.81,63.64,22.08,15.58,14.29,1.3,0.0,0.0,0.0,6.49,2.6,14.29,11.69,11.69,5.19,5.19,29.87,2.6,1.3,3.9,1.3,2.6,2.6,0.0,2.6,1.3,0.0,0.0,3.9,1.3,0.0,0.0,0.0,15.58,6.49,1.3,0.0,1.3,2.6,3.9,0.0,0.0,0.0,0.0,0.0,0.0,0.0,0.0,0.0,6.49,2.6,1.3,0.0,1.3,1.3,1.3,22.08,3.9,18.18,3.9,7.79,7.79,0.0,0.0,0.0,0.0,0.0,3.9,0.0,0.0,0.0,0.0,0.0,0.0,18.18,6.49,3.9,0.0,0.0,0.0,0.0,0.0,0.0,7.79,0.0,0.0,2.5714,2.8,3.0,1.0,1.0,1.0,1.72939,1.46269,1.84479,1.0,6,2.574710843,-0.01071428571,383,97,1,every once in a while i get the concept of death stuck in my mind thinking i m not going to be here anymore thinking my parents won t be here thinking what s going to happen after i die just thinking about how we all are mortal that gives me such bad anxiety i disassociate and i try to go back to normal i can t i m in that state right now and i really don t know what to do
480,1532874098,3,4.519164619,145,28.92,26.74,99.0,4.63,29.0,16.55,95.17,61.38,16.55,11.03,7.59,1.38,0.0,0.0,2.07,5.52,2.76,15.86,9.66,6.21,9.66,4.83,20.0,8.28,4.83,0.0,1.38,2.07,4.83,1.38,3.45,1.38,0.69,1.38,9.66,0.0,0.0,0.0,0.0,14.48,5.52,0.69,1.38,4.14,1.38,4.83,2.76,0.0,0.0,2.76,0.69,0.69,0.0,0.0,0.0,8.28,2.07,4.83,1.38,1.38,0.69,6.21,10.34,2.07,20.69,2.07,6.9,12.41,1.38,0.0,0.0,0.0,0.0,0.0,0.69,0.0,0.0,0.0,0.0,0.69,11.72,3.45,4.14,0.0,0.0,0.0,0.0,0.0,0.0,2.07,1.38,0.69,2.8571,2.625,3.0,1.0,1.125,1.0,1.69721,1.50827,1.87685,1.0,3,4.726191646,0.1197916667,761,160,0,i don t remember always being like this but over the last two years or so i have had a few tumultuous friendships dating connections with people i make deep connections quickly or seemingly deep anyways with lots of self disclosure and vice versa and after things don t work out i feel like i am lost and won t be able to cope on my own i recently started talking to someone again after not talking to them for a few months there was no bad blood between us we just decided it would be best to move on and not talk anymore they reached out first about a month ago then nothing i have been going through it at work feeling overwhelmed and anxious and so i feel stupid for doing this but i began talking to them again i feel better even if its slight
