574,1516805763,30,4.282131148,60,6.55,50.0,3.37,96.76,12.0,16.67,91.67,58.33,26.67,16.67,8.33,0.0,0.0,8.33,0.0,10.0,1.67,8.33,10.0,8.33,6.67,0.0,23.33,0.0,0.0,0.0,3.33,5.0,5.0,5.0,0.0,0.0,0.0,0.0,11.67,0.0,0.0,1.67,6.67,21.67,5.0,3.33,3.33,6.67,3.33,3.33,1.67,1.67,0.0,0.0,0.0,0.0,0.0,0.0,0.0,6.67,0.0,0.0,1.67,0.0,5.0,5.0,11.67,0.0,5.0,0.0,5.0,0.0,0.0,0.0,0.0,0.0,0.0,0.0,0.0,0.0,0.0,0.0,0.0,0.0,15.0,5.0,3.33,0.0,0.0,3.33,0.0,0.0,0.0,0.0,3.33,0.0,2.9167,2.5,2.6,1.0,1.125,1.0,1.7296,1.49259,1.89291,0.94,27,3.869639344,0.1925170068,323,70,0,quite frankly him being so nonchalant about the whole thing kind of baffles me does he just trust her that much? or is it me he trusts? his reaction or lack of one kept on making me think i was overreacting and reading too much into things i could see that fred certainly thought it was messed up even half conscious
384,1529801132,7,5.828378378,74,54.5,96.04,4.5,97.99,14.8,18.92,86.49,56.76,21.62,13.51,4.05,1.35,8.11,0.0,0.0,8.11,8.11,12.16,5.41,1.35,10.81,0.0,17.57,4.05,1.35,4.05,1.35,2.7,5.41,5.41,0.0,0.0,0.0,0.0,17.57,0.0,0.0,0.0,0.0,13.51,2.7,1.35,4.05,2.7,1.35,5.41,0.0,0.0,0.0,0.0,0.0,0.0,0.0,0.0,0.0,10.81,4.05,2.7,2.7,1.35,0.0,0.0,12.16,0.0,2.7,0.0,1.35,1.35,1.35,0.0,0.0,0.0,2.7,0.0,0.0,0.0,0.0,0.0,0.0,0.0,9.46,6.76,0.0,0.0,0.0,0.0,0.0,0.0,0.0,0.0,2.7,0.0,2.75,2.5,3.0,1.2143,1.1667,1.0,1.73983,1.56452,1.91782,0.89,6,5.649567568,0.125,392,81,0,so we are striving to find that balance between building an inviting and encouraging community village and the first rungs on the ladder to independence i read all of your posts and take mental notes as to what you are telling each other of what you need or the advice you give a newcomer but it would be fantastic if you dropped me a note telling me of what you think thanks god bless
118,1515334058,49,5.997,98,25.79,41.92,52.86,64.46,19.6,12.24,90.82,60.2,14.29,11.22,7.14,2.04,0.0,2.04,0.0,3.06,8.16,11.22,12.24,8.16,12.24,2.04,19.39,3.06,2.04,3.06,1.02,1.02,8.16,5.1,3.06,1.02,0.0,1.02,9.18,2.04,1.02,3.06,3.06,12.24,0.0,5.1,1.02,1.02,1.02,4.08,3.06,2.04,0.0,1.02,1.02,0.0,1.02,0.0,0.0,12.24,4.08,2.04,2.04,3.06,2.04,2.04,15.31,1.02,13.27,0.0,7.14,7.14,1.02,0.0,0.0,0.0,2.04,0.0,0.0,0.0,0.0,0.0,0.0,0.0,8.16,2.04,2.04,0.0,0.0,3.06,0.0,0.0,0.0,1.02,0.0,0.0,2.8333,2.625,3.0,1.0,1.1429,1.0,1.67611,1.4907,1.89057,0.79,37,6.488,0.1979591837,474,107,1,we are in an uneasy peace right now and i don t touch her although i am still the same caring guy but with precautions what did i do to deserve this? and why do bad men get the good wife that sticks around and the good men always lose? i want to have my life back but i cannot see how? filling for a divorce will create a huge scandal since we are a minority as christians and church laws prevail her so i am also looking at a minimum of 6 years till any verdict is made
27,1501335816,94,9.733411765,85,23.56,54.68,28.81,70.09,17.0,24.71,88.24,55.29,21.18,14.12,5.88,0.0,5.88,0.0,2.35,7.06,4.71,8.24,12.94,2.35,4.71,2.35,16.47,5.88,2.35,2.35,0.0,1.18,7.06,4.71,2.35,1.18,0.0,0.0,8.24,0.0,0.0,0.0,0.0,17.65,8.24,5.88,3.53,3.53,0.0,4.71,2.35,1.18,0.0,1.18,7.06,0.0,7.06,0.0,1.18,9.41,0.0,3.53,3.53,0.0,3.53,1.18,12.94,0.0,2.35,1.18,1.18,0.0,0.0,2.35,0.0,1.18,0.0,0.0,1.18,0.0,0.0,0.0,1.18,0.0,16.47,5.88,8.24,0.0,0.0,0.0,0.0,0.0,0.0,0.0,2.35,0.0,2.8333,3.0,3.0,1.0,1.125,1.0,1.77851,1.44722,1.84728,0.99,12,8.392941176,0.215,508,99,0,mushrooms lsd and dmt have been the most effective means for me to solve my anxiety if you choose to consume these drugs however please be aware that these are powerful psychoactive substances that can have repercussions on your mental well being physically they are incredibly safe personally they allowed me to view my life free from the ego which let me adopt a healthier mindset if you are using drugs which includes alcohol to escape your negative feelings you are not solving the problem
310,1523696616,2,4.413882353,85,76.06,4.98,99.0,1.0,17.0,10.59,91.76,55.29,16.47,15.29,12.94,0.0,0.0,2.35,0.0,1.18,4.71,18.82,5.88,3.53,5.88,2.35,20.0,7.06,3.53,0.0,0.0,3.53,3.53,0.0,3.53,2.35,1.18,0.0,4.71,0.0,0.0,0.0,2.35,12.94,3.53,2.35,1.18,2.35,1.18,5.88,2.35,0.0,0.0,2.35,4.71,4.71,0.0,0.0,0.0,8.24,0.0,2.35,4.71,0.0,1.18,9.41,4.71,1.18,16.47,2.35,8.24,5.88,0.0,0.0,0.0,1.18,0.0,1.18,0.0,0.0,0.0,0.0,0.0,0.0,7.06,5.88,1.18,0.0,0.0,0.0,0.0,0.0,0.0,0.0,0.0,0.0,2.4,2.5714,3.0,1.0,1.0,1.0,1.73371,1.67467,1.77066,1.0,14,5.477647059,0.07142857143,403,91,1,he kept the pressure on my throat and i felt as if i was going to die or become unconscious erik finally let go only to hit me in my head a few times i felt very scared from not being able to breath every time i tried begging erik to stop he told me to shut up that i was not allowed to talk erik used my hair as handles to bash my head on the wall at several different times throughout the attack
252,1524687486,11,3.374577922,86,64.98,59.18,49.53,1.0,14.33,12.79,90.7,59.3,11.63,9.3,3.49,1.16,1.16,1.16,2.33,2.33,8.14,16.28,8.14,12.79,5.81,1.16,17.44,5.81,0.0,2.33,1.16,2.33,8.14,1.16,6.98,2.33,2.33,1.16,6.98,0.0,0.0,0.0,1.16,11.63,3.49,1.16,1.16,3.49,1.16,2.33,2.33,1.16,0.0,1.16,1.16,1.16,0.0,0.0,0.0,5.81,1.16,0.0,3.49,1.16,0.0,2.33,15.12,2.33,13.95,0.0,5.81,8.14,2.33,0.0,1.16,0.0,0.0,0.0,0.0,0.0,0.0,0.0,0.0,0.0,15.12,3.49,2.33,0.0,0.0,1.16,3.49,0.0,2.33,2.33,0.0,0.0,3.0,3.0,3.0,1.0,1.125,1.0,1.73372,1.51351,1.7727,1.0,6,4.331038961,-0.2692708333,442,100,1,don t worry there are 3 police cases in process but it is very sad how hard you have to fight to get real advocacy from the police for domestic violence even with all the evidence in the world and they just drag their feet i mean the violent incident with the gun happened almost a year ago! where is the justice in this system of ours?! i hope to find some soon starting with wednesday but i m just so scared to have to see him again!
291,1515044253,0,10.125,161,29.72,82.43,73.93,25.77,32.2,12.42,95.65,60.25,22.98,18.63,8.07,3.11,0.0,6.83,0.62,4.35,5.59,11.8,4.35,6.83,9.94,1.24,13.04,8.7,3.73,3.11,3.73,2.48,6.21,3.11,3.11,0.0,1.86,0.62,19.25,0.0,1.86,6.21,1.24,6.83,0.62,1.24,0.62,1.86,0.0,3.73,1.86,0.0,0.62,1.24,0.62,0.0,0.0,0.0,0.62,8.7,4.35,0.62,1.24,2.48,0.0,8.7,3.11,1.24,19.88,0.0,4.97,14.91,1.24,1.24,0.62,1.24,0.0,0.62,1.24,0.0,0.0,0.0,0.62,0.62,11.8,3.11,6.21,0.0,0.0,0.0,0.0,1.86,0.0,0.62,0.0,0.0,2.75,2.625,3.0,1.0,1.1429,1.0,1.72693,1.61622,1.87034,0.44,16,9.289382716,0.1009259259,802,180,1,almost too well she extends our date twice buys us a drink each starts a make out session which lasts for 2 hours calls me hot and although neither of us had a house free she gave me oral too although she said she had a great time which i replied to i then waited to respond to her next message and i don t know if that killed any momentum because i was already very delayed when we first got talking of course anyway despite our great date and a second one lined up when i asked her out a day later she ended up cancelling on me and then told me a week later that she got more serious with another guy which to me only translated as him being hot and me being ugly they broke things off a week later and she did ask me out again but at one stage i annoyed her with a jokey message
135,1483481508,20,4.428108108,68,22.92,1.0,99.0,1.76,13.6,19.12,94.12,69.12,19.12,11.76,11.76,0.0,0.0,0.0,0.0,7.35,2.94,22.06,11.76,8.82,7.35,8.82,20.59,1.47,1.47,1.47,1.47,1.47,5.88,1.47,4.41,2.94,1.47,0.0,4.41,1.47,0.0,0.0,0.0,20.59,2.94,4.41,0.0,1.47,4.41,8.82,0.0,0.0,0.0,0.0,7.35,1.47,4.41,1.47,0.0,8.82,1.47,1.47,4.41,1.47,1.47,0.0,16.18,1.47,11.76,0.0,5.88,5.88,1.47,1.47,1.47,0.0,0.0,0.0,2.94,1.47,0.0,1.47,0.0,0.0,17.65,7.35,1.47,0.0,0.0,0.0,0.0,0.0,0.0,8.82,0.0,0.0,2.9167,2.6667,2.6,1.1,1.0,1.0,1.72244,1.39667,1.8915,0.77,12,6.606324324,-0.1416666667,363,80,1,i m not competent to deal with life despite being 21 i m living like a parasite on my family i m so tired of not getting to sleep at night because i m constantly worrying about the future and not being in control of it because i can t trust myself not to fuck everything up by panicking it all just seems so absolutely futile i don t know what to do anymore
645,1531097809,24,-0.3058954248,76,14.15,1.33,99.0,9.56,15.2,10.53,92.11,59.21,19.74,13.16,11.84,0.0,0.0,0.0,1.32,6.58,7.89,9.21,11.84,7.89,7.89,5.26,25.0,2.63,1.32,2.63,0.0,1.32,1.32,0.0,1.32,0.0,1.32,0.0,2.63,0.0,0.0,0.0,0.0,17.11,0.0,3.95,2.63,5.26,0.0,6.58,0.0,0.0,0.0,0.0,2.63,0.0,1.32,0.0,1.32,5.26,0.0,1.32,1.32,2.63,0.0,3.95,21.05,1.32,19.74,1.32,11.84,6.58,2.63,1.32,2.63,1.32,0.0,0.0,1.32,1.32,0.0,0.0,0.0,0.0,18.42,6.58,0.0,0.0,0.0,0.0,0.0,0.0,0.0,11.84,0.0,0.0,2.4286,2.625,3.0,1.125,1.125,1.0,1.69762,1.51212,1.84205,0.95,20,2.530980392,0.05595238095,376,90,1,i m living in my car right now which sucks because the radiator just got a hole in it and now i can t keep the ac on at night i m working a full time job but i m not making enough to rent an apartment or even a hotel what i need is some food something portable that won t need refrigeration i m former army so i m used to mre s but i don t have anywhere local to get them
668,1523462995,91,2.065238095,57,53.43,97.28,38.82,97.58,11.4,17.54,91.23,59.65,17.54,14.04,3.51,7.02,0.0,0.0,3.51,3.51,5.26,15.79,15.79,1.75,5.26,0.0,21.05,1.75,0.0,0.0,0.0,5.26,5.26,5.26,0.0,0.0,0.0,0.0,17.54,0.0,0.0,0.0,0.0,10.53,1.75,0.0,3.51,3.51,1.75,1.75,0.0,0.0,0.0,0.0,1.75,0.0,0.0,0.0,0.0,17.54,14.04,0.0,7.02,1.75,0.0,3.51,17.54,1.75,15.79,1.75,10.53,3.51,1.75,3.51,0.0,1.75,0.0,0.0,1.75,0.0,1.75,0.0,0.0,0.0,21.05,7.02,1.75,1.75,0.0,0.0,0.0,0.0,0.0,7.02,0.0,3.51,3.0,3.0,2.8,1.375,1.0,1.0,1.82202,1.52917,1.83649,0.91,5,3.558920635,0.55,292,69,0,at this point my friend s family s finances are all but running out we started a gofundme to help them out and would love to get any help we can reddit has done and continues to do amazing things i m hoping we can do our bit to help them out here s a link to the gofundme campaign url
374,1508651900,9,5.6455,80,9.63,54.96,11.36,2.89,16.0,18.75,90.0,57.5,27.5,23.75,12.5,0.0,0.0,11.25,0.0,3.75,2.5,8.75,10.0,6.25,6.25,0.0,25.0,1.25,0.0,2.5,1.25,1.25,10.0,3.75,6.25,1.25,5.0,1.25,13.75,0.0,0.0,0.0,11.25,15.0,5.0,3.75,3.75,1.25,1.25,0.0,3.75,0.0,0.0,3.75,1.25,0.0,1.25,0.0,0.0,6.25,1.25,0.0,3.75,1.25,1.25,11.25,10.0,0.0,11.25,2.5,5.0,5.0,0.0,0.0,0.0,0.0,1.25,1.25,1.25,0.0,0.0,1.25,0.0,0.0,11.25,6.25,2.5,0.0,0.0,0.0,0.0,0.0,0.0,0.0,2.5,0.0,2.6,2.5,3.0,1.0,1.1818,1.0,1.76622,1.51233,1.87038,1.0,1,7.0225,0.1125,412,89,1,i knew i was unhappy in this relationship he has a very impulsive personality he destroys his property and overdoses on drugs when he is angry when i was telling him that i needed some time on my own he would threaten to kill himself so that i felt obligated to come take care of him happened 2 times i would stay because i felt i had the moral obligation to make sure he is okay i felt very manipulated
614,1526132222,2,6.115983607,59,91.03,75.12,76.95,57.83,14.75,18.64,88.14,50.85,11.86,3.39,1.69,0.0,0.0,1.69,0.0,8.47,1.69,23.73,5.08,3.39,6.78,0.0,18.64,3.39,1.69,1.69,1.69,5.08,5.08,3.39,1.69,1.69,0.0,0.0,10.17,0.0,1.69,3.39,0.0,10.17,1.69,5.08,0.0,5.08,0.0,1.69,1.69,1.69,0.0,0.0,3.39,0.0,1.69,0.0,0.0,11.86,3.39,0.0,3.39,1.69,3.39,5.08,8.47,1.69,22.03,3.39,15.25,3.39,5.08,0.0,0.0,0.0,0.0,0.0,1.69,0.0,1.69,0.0,0.0,0.0,166.1,6.78,3.39,0.0,0.0,0.0,0.0,0.0,0.0,3.39,0.0,152.54,3.0,2.6364,3.0,1.375,1.0,1.0,1.75709,1.408,1.80103,0.63,32,6.993565574,0.22,322,67,0,was looking at therapies for my gf and this stood out love any feedback from anyone who has used this she s going to start monday at 5 mg and go up from there here s a collection of studies on both prevention various effects and treatment benefits noted using hydrocortisone in people with ptsd or at high risk of it
164,1498673102,7,6.323102564,123,3.27,11.14,91.58,1.0,24.6,11.38,96.75,69.11,23.58,11.38,10.57,0.0,0.81,0.0,0.0,12.2,3.25,13.01,17.89,8.13,8.94,4.07,21.95,2.44,3.25,2.44,4.07,1.63,5.69,0.81,4.88,0.0,3.25,0.81,10.57,0.0,2.44,0.81,1.63,17.07,1.63,1.63,1.63,4.07,2.44,8.13,0.81,0.0,0.0,0.81,5.69,0.0,0.0,4.88,0.81,4.07,0.81,2.44,1.63,0.81,0.81,8.94,11.38,1.63,10.57,0.81,2.44,7.32,0.0,0.81,0.0,0.0,0.0,0.0,0.81,0.81,0.0,0.0,0.0,0.0,14.63,3.25,4.88,0.0,0.0,0.81,0.0,0.0,0.0,4.07,1.63,0.0,2.7778,2.625,3.0,1.0,1.125,1.0,1.73558,1.48302,1.88954,0.82,2,7.201538462,0.1166666667,602,141,1,i had been raped by two different people as a kid between ages 5 to 8 i was raped by someone who s name i wont even call out and when i was eleven i was raped by this odd couple the guy raped me the woman just was present while it was happening i don t know if it s that or that every time i have had a crush on someone that someone always fall for one of my best friends but i really feel like i wont be able to have sex unless i am extremely drunk it s not really about losing my virginity anymore because it has already been stolen but it s about not freaking out how did you guys do it?
567,1514790159,24,5.45712766,92,5.04,54.33,16.76,25.77,18.4,8.7,96.74,67.39,25.0,19.57,11.96,1.09,1.09,5.43,0.0,5.43,2.17,11.96,11.96,8.7,8.7,3.26,25.0,1.09,1.09,3.26,0.0,1.09,4.35,2.17,2.17,2.17,0.0,0.0,19.57,3.26,1.09,6.52,1.09,20.65,2.17,2.17,8.7,6.52,1.09,5.43,3.26,1.09,2.17,0.0,0.0,0.0,0.0,0.0,0.0,6.52,4.35,0.0,0.0,2.17,0.0,0.0,20.65,2.17,9.78,1.09,4.35,5.43,0.0,2.17,1.09,0.0,0.0,0.0,1.09,0.0,1.09,0.0,0.0,0.0,13.04,3.26,4.35,1.09,0.0,2.17,0.0,0.0,0.0,2.17,0.0,0.0,2.7143,2.625,3.0,1.125,1.1818,1.0,1.71524,1.48,1.96621,0.78,6,6.429234043,0.1,450,104,1,i am aftraid to phone her ever because i worry she will be grumpy and she usually only phones when she needs to get advice or something like that i think i want to not see her in the future but i don t know if i am overreacting? i also don t want to cause drama in the family which is very stressful to me if i could get some advice that would be very helpful thank you tldr should i stay in contact with my sister who still talks to our dad?
372,1510730978,4,8.324959872,168,7.69,42.9,68.01,6.15,28.0,10.71,95.24,61.9,23.81,19.05,9.52,1.79,0.0,7.74,0.0,4.76,3.57,11.31,8.93,5.95,13.1,3.57,23.81,2.38,2.38,0.6,0.6,3.57,4.17,1.19,2.98,0.0,1.79,0.0,17.26,1.19,0.0,0.0,9.52,17.26,1.79,2.38,0.6,4.76,2.38,7.74,2.98,1.19,1.19,0.6,3.57,1.19,0.0,0.0,2.38,9.52,2.98,2.38,2.38,2.38,0.6,5.36,14.29,2.38,13.1,1.79,6.55,5.36,0.6,2.98,1.19,0.0,0.0,0.0,0.0,0.0,0.0,0.0,0.0,0.0,16.67,4.76,3.57,0.0,0.0,0.0,0.0,0.0,0.0,5.95,2.38,0.0,2.8,2.8889,3.0,1.0,1.125,1.0,1.74167,1.54228,1.8524,1.0,2,8.182199037,-0.04027777778,829,194,1,i ll call him out on his behavior or try to stand up for myself and then he ll either get mad and give me the silent treatment and not apologize or he ll tell me i m lying and that he didn t do or say something even though i know he did he criticizes my parenting and tells me i m lazy since i m a sahm even though i do all the cleaning cooking taking care of our toddler taking care of our pets and anything else around the house with little help from him because he feels entitled to not do anything since he works and i don t to top it all off he doesn t think he has a drinking problem yet always drinks at least 3 beers or more every night he also slapped my son and left a mark on his face while we were camping i didn t see him do it because i went to go pee but saw it and asked about it when i got back
233,1509787158,32,5.780192308,52,42.69,99.0,26.92,99.0,10.4,19.23,88.46,61.54,23.08,13.46,0.0,0.0,13.46,0.0,0.0,9.62,3.85,17.31,9.62,5.77,5.77,0.0,23.08,1.92,0.0,0.0,0.0,0.0,9.62,9.62,0.0,0.0,0.0,0.0,13.46,0.0,0.0,0.0,0.0,11.54,3.85,1.92,1.92,1.92,0.0,1.92,1.92,0.0,1.92,0.0,0.0,0.0,0.0,0.0,0.0,7.69,0.0,1.92,5.77,0.0,0.0,1.92,11.54,1.92,13.46,3.85,5.77,3.85,5.77,0.0,0.0,0.0,0.0,0.0,1.92,0.0,0.0,0.0,1.92,0.0,11.54,5.77,1.92,0.0,0.0,3.85,0.0,0.0,0.0,0.0,0.0,0.0,2.8462,2.625,3.0,1.3,1.1429,1.0,1.68878,1.575,1.92035,1.0,3,5.031384615,0.3569444444,301,58,0,read from your sheet and you will be accepted by others effortlessly this also starts the beginning of you allowing yourself to be yourself do you believe strongly about animal rights ? brilliant that would go down pretty well in the court? sounds commendable put it on your sheet and read from it
592,1516511505,2,5.890857143,99,34.01,45.96,80.98,12.41,19.8,18.18,94.95,58.59,21.21,16.16,8.08,3.03,0.0,5.05,0.0,5.05,5.05,14.14,15.15,2.02,5.05,2.02,26.26,6.06,5.05,0.0,1.01,2.02,1.01,0.0,1.01,0.0,0.0,0.0,11.11,0.0,0.0,0.0,5.05,11.11,3.03,3.03,0.0,0.0,0.0,5.05,3.03,2.02,1.01,0.0,1.01,0.0,1.01,0.0,0.0,10.1,3.03,3.03,2.02,1.01,1.01,3.03,15.15,4.04,15.15,0.0,11.11,4.04,7.07,0.0,1.01,4.04,0.0,0.0,0.0,0.0,0.0,0.0,0.0,0.0,14.14,5.05,0.0,0.0,0.0,0.0,0.0,1.01,2.02,6.06,0.0,0.0,2.8333,2.6667,3.0,1.1429,1.1429,1.0,1.72871,1.57978,1.88518,0.63,16,6.631190476,-0.09375,521,113,0,he told me that we are at different places in life he is looking to buy houses and i m just starting grad school i understand that i won t be financially stable for a few more years because i do have a student loan but that being said i m getting a master s in engineering so at worst i m looking at a 5 year payback plan he told me that he doesn t think we will work out long term because of being in different places he thinks making adjustments to the differences between us will be forcing things to work out
329,1522355204,49,0.6589215686,34,66.07,61.58,14.7,25.77,6.8,8.82,88.24,50.0,23.53,5.88,5.88,0.0,0.0,0.0,0.0,17.65,0.0,17.65,8.82,0.0,0.0,0.0,17.65,2.94,0.0,5.88,0.0,8.82,5.88,2.94,2.94,0.0,2.94,0.0,11.76,0.0,0.0,0.0,0.0,14.71,2.94,0.0,2.94,5.88,2.94,0.0,0.0,0.0,0.0,0.0,5.88,2.94,2.94,0.0,0.0,5.88,0.0,0.0,2.94,2.94,0.0,0.0,20.59,0.0,8.82,0.0,8.82,0.0,5.88,0.0,0.0,0.0,2.94,0.0,2.94,2.94,0.0,0.0,0.0,0.0,26.47,14.71,2.94,2.94,0.0,0.0,0.0,0.0,0.0,0.0,5.88,0.0,2.7778,2.3333,2.4,1.4,1.1818,1.0,1.619,1.40714,1.92872,0.87,26,1.543529412,-0.1625,181,43,0,holy crap this is long migraine ramble thanks to any who have read all of this i can give verification of my claims to anyone who needs it edited to add wishlist link above
657,1538671767,1,3.01,56,79.57,5.42,99.0,1.0,11.2,14.29,89.29,51.79,14.29,10.71,10.71,0.0,0.0,0.0,0.0,3.57,8.93,14.29,3.57,3.57,10.71,0.0,10.71,7.14,3.57,0.0,0.0,7.14,7.14,0.0,7.14,1.79,0.0,5.36,0.0,0.0,0.0,0.0,0.0,12.5,5.36,0.0,1.79,3.57,0.0,5.36,0.0,0.0,0.0,0.0,0.0,0.0,0.0,0.0,0.0,8.93,0.0,1.79,7.14,0.0,0.0,7.14,3.57,0.0,19.64,5.36,7.14,7.14,5.36,0.0,0.0,1.79,0.0,0.0,0.0,0.0,0.0,0.0,0.0,0.0,21.43,8.93,12.5,0.0,0.0,0.0,0.0,0.0,0.0,0.0,0.0,0.0,2.5556,2.5714,3.0,1.0,1.1429,1.0,1.71805,1.63333,1.79007,0.67,3,4.581571429,-0.1333333333,291,68,1,my car broke again massive stress helplessness and hopelessness as if the walls are closing in on me i knew a bit of mechanic work and decided to fix the car myself after a few weeks of investigation learning part orders etc etc i did fix it but it wasted a lot of my time though
369,1536429398,6,2.097603306,115,51.43,43.08,90.01,58.68,23.0,9.57,95.65,63.48,18.26,12.17,6.96,5.22,0.0,0.0,0.0,6.09,6.09,19.13,11.3,4.35,8.7,2.61,23.48,4.35,4.35,0.87,0.0,1.74,5.22,3.48,1.74,0.87,0.87,0.0,7.83,0.87,0.87,0.0,0.0,13.04,0.0,0.87,3.48,2.61,1.74,4.35,0.0,0.0,0.0,0.0,0.87,0.87,0.0,0.0,0.0,14.78,5.22,1.74,4.35,3.48,0.87,4.35,15.65,1.74,20.87,1.74,3.48,15.65,3.48,0.0,2.61,3.48,0.0,0.0,0.87,0.87,0.0,0.0,0.0,0.0,9.57,4.35,0.0,0.0,0.0,0.0,0.0,0.0,0.0,5.22,0.0,0.0,2.875,2.4286,3.0,1.1818,1.25,1.0,1.74704,1.49072,1.91623,0.88,15,3.659578512,0.08541666667,568,132,0,for me it would start with rent we got approved for an apartment but some shit happened and we don t have 1st months anymore so we can t move in we still have time to come up with it but i doubt we will before the deadline after we got that i have an employment opportunity lined up but i can t start the job until after the baby so i d just have to manage to keep the rent paid until dec which would be after due date and minimum recovery time after that i d just need to make sure i had some decent savings up by then to get everything i d need to start the gig
211,1523139941,88,6.058032787,61,91.1,43.48,3.16,1.13,12.2,24.59,81.97,54.1,13.11,13.11,6.56,0.0,0.0,6.56,0.0,0.0,8.2,18.03,1.64,3.28,6.56,3.28,11.48,1.64,1.64,0.0,0.0,1.64,6.56,1.64,4.92,0.0,1.64,3.28,13.11,1.64,0.0,0.0,6.56,14.75,0.0,6.56,1.64,1.64,3.28,4.92,0.0,0.0,0.0,0.0,0.0,0.0,0.0,0.0,0.0,8.2,0.0,3.28,6.56,1.64,3.28,8.2,4.92,0.0,6.56,1.64,3.28,1.64,8.2,0.0,0.0,3.28,0.0,0.0,0.0,0.0,0.0,0.0,0.0,0.0,19.67,8.2,4.92,0.0,0.0,0.0,0.0,0.0,0.0,0.0,6.56,0.0,2.7778,2.75,3.0,1.0,1.125,1.0,1.70132,1.644,1.71854,0.84,46,5.804065574,-0.04,349,73,1,i asked for nothing but a declaration a document detailing finances from the divorce he stole from me i asked for nothing but restitution he fought forced me to hire a lawyer more money dragged out the case and led to have alimony imposed upon if he failed to make restitution he still failed to even honestly attempt to make restitution
249,1518384002,11,1.180434783,68,87.47,50.0,99.0,1.76,13.6,10.29,98.53,61.76,19.12,17.65,8.82,1.47,0.0,7.35,0.0,1.47,7.35,22.06,1.47,2.94,8.82,1.47,25.0,0.0,0.0,1.47,0.0,0.0,2.94,0.0,2.94,0.0,1.47,1.47,11.76,0.0,0.0,0.0,7.35,4.41,0.0,1.47,0.0,1.47,0.0,1.47,1.47,0.0,1.47,0.0,4.41,2.94,0.0,1.47,0.0,8.82,1.47,1.47,2.94,2.94,0.0,13.24,7.35,2.94,36.76,10.29,22.06,5.88,0.0,0.0,5.88,0.0,0.0,0.0,1.47,1.47,0.0,0.0,0.0,0.0,10.29,7.35,1.47,0.0,0.0,0.0,0.0,0.0,0.0,1.47,0.0,0.0,2.5714,2.7,3.0,1.1429,1.1429,1.0,1.77483,1.69667,1.8137,0.93,25,2.747173913,-0.2136111111,320,76,1,he got off of me and went into the other room i laid on his couch trying to breathe while crying eventually i got up and started heading towards the door t started putting his shoes on and said why don t we go for a little walk i told him to stay the fuck away from me and i ran out of his door and down the street
93,1539130631,1,9.60856,121,18.49,1.65,99.0,1.0,30.25,13.22,93.39,58.68,19.83,17.36,17.36,0.0,0.0,0.0,0.0,2.48,4.13,11.57,13.22,4.96,9.09,1.65,22.31,2.48,0.0,1.65,0.83,2.48,5.79,0.0,4.96,3.31,0.0,0.83,2.48,0.0,0.0,0.0,0.0,19.83,5.79,0.83,4.96,4.96,2.48,4.96,3.31,2.48,0.83,0.0,5.79,1.65,4.13,0.0,0.0,2.48,0.0,0.0,2.48,0.0,0.0,4.96,14.05,0.83,13.22,2.48,4.13,6.61,2.48,0.0,0.0,0.0,0.0,0.0,0.0,0.0,0.0,0.0,0.0,0.0,12.4,3.31,4.96,0.83,0.0,0.0,0.0,0.0,0.0,3.31,0.0,0.0,2.8333,2.8889,3.0,1.0,1.1429,1.0,1.82743,1.47748,1.88921,1.0,4,10.0192,-0.0125,623,136,1,i ve never been medically diagnosed with anxiety and i know that i would need to see a professional to officially determine if i really had anxiety but sometimes i relate to symptoms of anxiety i see online and wonder if i should be concerned some things that have led me to think i may have anxiety i ve been performing on stages for all of my life but i still find my heart racing and knees weak every time i m on stage one time i messed up a performance and when i saw my peers the next day i had to remove myself from the situation and go to a place where i could be alone i don t mind public speaking though
239,1496018529,3,2.774354839,56,1.34,29.6,64.41,6.15,11.2,10.71,94.64,71.43,37.5,28.57,16.07,0.0,0.0,12.5,0.0,8.93,1.79,16.07,17.86,8.93,3.57,1.79,28.57,0.0,0.0,3.57,1.79,1.79,1.79,0.0,1.79,1.79,0.0,0.0,17.86,0.0,0.0,12.5,0.0,14.29,1.79,1.79,0.0,1.79,3.57,5.36,0.0,0.0,0.0,0.0,0.0,0.0,0.0,0.0,0.0,5.36,0.0,1.79,1.79,1.79,0.0,3.57,19.64,0.0,12.5,3.57,5.36,3.57,0.0,1.79,0.0,0.0,0.0,0.0,0.0,0.0,0.0,0.0,0.0,0.0,30.36,8.93,5.36,0.0,0.0,0.0,0.0,0.0,3.57,8.93,3.57,0.0,2.5556,2.8,3.0,1.0,1.1429,1.0,1.79109,1.444,1.92414,0.67,4,4.662129032,0.225,304,73,1,she s the first person i ve ever really opened up to i haven t told her everything about whats happened but she does know about my anxiety which i get from my ptsd and she reacts sportively to it to some extent i let me be myself around her whatever i am she s moving she s moving to maryland
353,1539487053,10,5.3875,66,10.74,11.29,99.0,1.59,13.2,15.15,100.0,59.09,18.18,7.58,7.58,0.0,0.0,0.0,0.0,10.61,6.06,7.58,16.67,10.61,6.06,0.0,27.27,3.03,4.55,0.0,0.0,1.52,6.06,1.52,4.55,1.52,1.52,1.52,1.52,0.0,0.0,0.0,0.0,27.27,10.61,1.52,4.55,4.55,0.0,6.06,7.58,0.0,0.0,4.55,1.52,1.52,0.0,0.0,0.0,3.03,0.0,0.0,1.52,1.52,0.0,4.55,15.15,1.52,16.67,1.52,3.03,12.12,0.0,0.0,0.0,0.0,0.0,0.0,0.0,0.0,0.0,0.0,0.0,0.0,16.67,6.06,6.06,0.0,0.0,1.52,0.0,0.0,0.0,3.03,0.0,0.0,2.7143,2.5833,3.0,1.0,1.0,1.0,1.71686,1.41017,1.96543,0.87,6,6.546352941,0.06071428571,363,77,1,but here i am hours later having a panic attack and wishing i could crawl out of my skin it s really triggering a sense memory i have so instead of remembering the event it feels like it s happening right now it is the most devastating ending to this day that could have possibly happened i was feeling so brave lately does anyone else get sense memories?
499,1531453371,3,7.210851064,94,20.74,3.56,99.0,1.0,18.8,10.64,93.62,61.7,21.28,12.77,11.7,0.0,1.06,0.0,0.0,8.51,3.19,13.83,10.64,6.38,8.51,2.13,20.21,5.32,3.19,0.0,1.06,1.06,7.45,0.0,7.45,4.26,1.06,1.06,1.06,0.0,0.0,0.0,0.0,13.83,3.19,0.0,1.06,4.26,2.13,5.32,3.19,0.0,0.0,0.0,5.32,2.13,3.19,0.0,0.0,4.26,0.0,3.19,1.06,0.0,2.13,6.38,10.64,2.13,17.02,1.06,7.45,8.51,2.13,0.0,1.06,0.0,0.0,2.13,1.06,1.06,0.0,0.0,0.0,0.0,9.57,5.32,2.13,0.0,0.0,0.0,0.0,0.0,0.0,0.0,2.13,0.0,2.8333,2.625,3.0,1.0,1.1818,1.0,1.76005,1.47381,1.79997,0.81,1,7.559021277,-0.3,486,103,1,i worry that if i sit around too often i will develop blood clots and die anything to do with death really on top of that i have been developing intrusive thoughts but the worst part is that last week i was laying in bed and randomly became afraid that i was going to lose my sense of reality and start hallucinating i have never hallucinated in my life unless you count the 2 times that i tried psychedelics and have never had this fear before but it scared the shit out of me
